BlockName,Category,CreatedOn,Crop,DistrictName,KCCCallID,KccAns,QueryText,QueryType,Season,Sector,StateName,day,month,year
"PATHAR DEWA",Others,2023-06-11T11:45:55.6,Others,DEORIA,5491282,"श्रीमान जी आपके यहाँ कोई बारिश की संभावना नहीं है 17 जून तक 2023 तक ,आपके यहाँ अधिकतम तापमान 44*c और न्यूनतम तापमान  26*c रहेगा और हवा 4 से 14 किलोमीटर प्रति घंटा की रफ़्तार से चलेगा","Farmer asked query on Weather",Weather,NA,AGRICULTURE,"UTTAR PRADESH",11,6,2023
"SUJAN GANJ",Others,2023-06-11T12:01:20.167,"Paddy (Dhan)",JAUNPUR,5492295,"श्रीमान जी 11 जून से 17 जून तक प्रत्येक दिन वर्षा की संभावना है,आज का न्यूनतम तापमान 37°C तथा अधिकतम तापमान 43°C रहने की संभावना है, हवा की गति 11km/hr से 22 km/hr. रहने की संभावना है, मौसम को देखते हुए कृषि संबंधी कार्य करें|","Farmer asked query on Weather",Weather,NA,AGRICULTURE,"UTTAR PRADESH",11,6,2023
GHIROR,Others,2023-06-11T12:05:57.347,Others,MAINPURI,5491734,"श्रीमान जी प्रधानमंत्री किसान सम्मान निधि योजना के बारे में अधिक जानकारी के लिए आप इस हेल्पलाइन नंबर पर संपर्क करें-011 24300606,155261,1800 180 1488
","Information about Pradhan Mantri Kisan Samman Nidhi Yojana?
","Government Schemes",NA,AGRICULTURE,"UTTAR PRADESH",11,6,2023
Sambhal,Others,2023-06-11T12:12:29.22,Others,"SAMBAL (BHIM NAGAR)",5490999,"श्रीमान जी कृषि यंत्रों एवं कस्टम हायरिंग सेंटर हेतु प्री बुकिंग टोकन प्रक्रिया विभागीय पारदर्शी किसान सेवा योजना पोर्टल www.upagriculture.com पर यंत्र पर अनुदान हेतु टोकन निकाले लिंक पर क्लिक कर ऑनलाइन प्री बुकिंग टोकन जनरेट किया जा सकेगा ऑनलाइन टोकन जनरेट करने के उपरांत प्राप्त चालान के माध्यम से निर्धारित समय के अंतर्गत नजदीकी यूनियन बैंक के किसी भी शाखा में निर्धारित जमानत धनराशि जमा करनी होगी चालान रसीद पोर्टल पर अपलोड नहीं किया जाना है बल्कि यंत्र क्रय करने के पश्चात पोर्टल पर बिल अपलोड करना है।
","Give information about the process of taking agricultural equipment grant ?
","Government Schemes",NA,AGRICULTURE,"UTTAR PRADESH",11,6,2023
Sambhal,Others,2023-06-11T12:12:50.373,Others,"SAMBAL (BHIM NAGAR)",5491000,"श्रीमान जी जमानत धनराशि का विवरण रुपए 10000 तक के अनुदान वाले कृषि यंत्र हेतु शुन्य रुपए तथा10,000 से अधिक तथा रुपए 100000 तक के अनुदान वाले कृषि यंत्र हेतु ₹2500 और रूपए एक लाख से अधिक अनुदान वाले कृषि यंत्रों कस्टम हायरिंग सेंटर हेतु ₹5000 है।
","Provide security deposit for agricultural equipment ?
","Government Schemes",NA,AGRICULTURE,"UTTAR PRADESH",11,6,2023
BHAGYANAGAR,Others,2023-06-11T12:13:46.207,Others,AURAIYA,5490978,"श्रीमान जी, आपके क्षेत्र में आज 11 जून से 17 जून तक का मौसम ज्ञात हो रहा है | सभी दिनों में आंशिक रूप से  बादल छाए रह सकते हैं | 12 - 16 जून तक बूंदाबांदी तथा 17 जून को बारिश की संभावनाएं बनी हुई है | आज का अधिकतम तापमान 39 डिग्री सेल्सियस तथा न्यूनतम तापमान 30 डिग्री सेल्सियस दर्ज किया जा रहा है, हवा की गति 07 से 11 किलोमीटर प्रति घंटे की दर से चलने की संभावना है, कृषि कार्य अपने क्षेत्र के मौसम के अनुसार करें |
","Farmer asked query on Weather",Weather,NA,AGRICULTURE,"UTTAR PRADESH",11,6,2023
RAMPURA,Others,2023-06-11T12:16:47.12,Others,JALAUN,5492010,"श्रीमान जी, प्रधानमंत्री किसान सम्मान निधि योजना के अंतर्गत अधिक जानकारी के लिए अपने ब्लॉक के बीज गोदाम प्रभारी महोदय अथवा जिले के  उप कृषि निदेशक कार्यालय में संपर्क करें |","Information About of PM Kisan Samman Nidhi Scheme Status .?","Government Schemes",NA,AGRICULTURE,"UTTAR PRADESH",11,6,2023
RATH,Others,2023-06-11T12:17:54.45,Others,HAMIRPUR,5491701,"	પ્રધાનમંત્રી કિસાન સમ્માન નિધિ યોજના નું બેનેફિશ્યિરી સ્ટેટ્સ ચેક કરવા માટે આ લિંક ઉપર ક્લિક કરો. https://pmkisan.gov.in/BeneficiaryStatus_New.aspx"," Ask about information on  PM - KISAN beneficiary status","Government Schemes",NA,AGRICULTURE,"UTTAR PRADESH",11,6,2023
GHOSI,Fruits,2023-06-11T12:18:06.027,Mango,MAU,5490963,"श्रीमान जी गोंद निकलने की समस्या निदान हेतु 250 ग्राम  कॉपर  सल्फेट +250 ग्राम  ज़िंक  सल्फेट  +125 बोरेक्स +100 ग्राम  बुझा हुवा चूना सभी को आपस में मिलाकर आम के पेड़ के थाले में डाले |","Information about gummosis control in Mango tree?","	Plant Protection	",NA,HORTICULTURE,"UTTAR PRADESH",11,6,2023
Sambhal,Others,2023-06-11T12:23:53.423,Others,"SAMBAL (BHIM NAGAR)",5491004,"मैडम जी कस्टम हायरिंग सेंटर योजना का लाभ लेने के लिए आप समूह भी बना सकते हैं या स्वता ले सकते हैं विकासखंड /तहसील/ जिला स्तर पर कस्टम हायरिंग केंद्रों की स्थापना हेतु लाभार्थी समूह को परियोजना लागत का अधिकतम 1000000 का 40% अधिकतम ₹400000 तक का अनुदान दे है अधिक जानकारी के लिए आप अपने यहां के जिला कृषि उपनिदेशक जी से संपर्क करें 
","Provide information related to custom hiring scheme ( CHC ) ?
","Government Schemes",NA,AGRICULTURE,"UTTAR PRADESH",11,6,2023
SYANA,Millets,2023-06-11T12:25:06.12,"Maize (Makka)",BULANDSHAHAR,5490901,"श्रीमान जी मक्का  की फसल में कीट नियंत्रण के लिए - Cartap Hydrochloride 4% GR 8-10 किलोग्राम /एकर मक्का के खेत में डाले और  सिंचाई कराये  
","Information of Insect Control In Maize Crop  ?
","	Plant Protection	",NA,AGRICULTURE,"UTTAR PRADESH",11,6,2023
TAMKUHIRAJ,Others,2023-06-11T12:26:21.233,Others,"KUSHI NAGAR",5491768,"महोदय आप प्रधानमंत्री किसान सम्मान निधि योजना  के अंतर्गत अपने खाते में रुपए ना आने की स्थिति में इसकी अधिक  जानकारी  के  लिए अपने जिले के उप कृषि निर्देशक या ब्लॉक के बीज गोदाम प्रभारी या BTM साहब से  संपर्क करे|
","There is No Money Coming into Our Accounts Under Pradhan Mantri Kisan Samman Nidhi Scheme..?
","Government Schemes",NA,AGRICULTURE,"UTTAR PRADESH",11,6,2023
KASGANJ,"Medicinal and Aromatic Plants",2023-06-11T12:31:25.59,Mentha,ETAH,5490875,"श्रीमान जी, आपके क्षेत्र में आज 11 जून से 17 जून तक का मौसम ज्ञात हो रहा है | सभी दिनों में आंशिक रूप से  बादल छाए रह सकते हैं | 12 - 16 जून तक बूंदाबांदी तथा 17 जून को बारिश की संभावनाएं बनी हुई है | आज का अधिकतम तापमान 39 डिग्री सेल्सियस तथा न्यूनतम तापमान 32 डिग्री सेल्सियस दर्ज किया जा रहा है, हवा की गति 07 से 11 किलोमीटर प्रति घंटे की दर से चलने की संभावना है, कृषि कार्य अपने क्षेत्र के मौसम के अनुसार करें |
","Farmer asked query on Weather",Weather,NA,HORTICULTURE,"UTTAR PRADESH",11,6,2023
BAR,Millets,2023-06-11T12:32:41.39,"Maize (Makka)",LALITPUR,5491879,"श्रीमान जी 11 जून से 17 जून के बीच हल्की बूंदाबांदी होने की संभावना है आंशिक रूप से बादल छाए रहेंगे आज का न्यूनतम तापमान 31 डिग्री सेल्सियस और अधिकतम तापमान 41 डिग्री सेल्सियस एवं हवा की गति 7 से 25 किलोमीटर प्रति घंटा रहने की संभावना है मौसम के अनुसार कृषि कार्य करें
","Farmer asked query on Weather",Weather,NA,AGRICULTURE,"UTTAR PRADESH",11,6,2023
MIHINPURWA,Cereals,2023-06-11T12:39:10.27,"Paddy (Dhan)",BAHRAICH,5491627,"महोदय आप बिस्पायरिबैक सोडियम 10 % SC @ 80-100 मिली/एकर की दर से 200 लीटर पानी में घोल बनाकर छिड़काव करें|","Information about Weed Control in Paddy Nursery.?","Weed Management",NA,AGRICULTURE,"UTTAR PRADESH",11,6,2023
SARDARNAGAR,Others,2023-06-11T12:40:26.99,Others,GORAKHPUR,5490762,"श्रीमान जी, 11 जून से 17 जून तक आंशिक रूप से बादल छाये रहेंगे और हल्की बूंदा - बांदी होने की संभावना है। आज का न्यूनतम तापमान 36°C और अधिकतम तापमान 42°C है और हवा की गति 2-6 किमी / घंटा रहने की संभावना है। मौसम के अनुसार कृषि कार्य करें","Farmer asked query on Weather",Weather,NA,AGRICULTURE,"UTTAR PRADESH",11,6,2023
Sangrampur,Others,2023-06-11T12:45:30.147,Others,"AMETHI ( Shahu Ji Maharaj)",5492012,"श्रीमान जी किसान सम्मान निधि योजना के अंतर्गत की स्थिति जानने के लिए पीएम किसान की ऑफिशियल वेबसाइट www.pmkisan.gov.in पीएम  के माध्यम से पंजीकरण संख्या दर्ज करके स्थिति की जानकारी प्राप्त करें या पीएम किसान हेल्पलाइन नंबर 155261/ 011-24300606 पर कॉल करके पंजीकृत मोबाइल नंबर या पंजीकृत आधार नंबर दर्ज करके स्थिति जान सकते हैं।","Please provide Know Beneficiary Status information under PM Kisan Samman Nidhi Yojana. ? 
","Government Schemes",NA,AGRICULTURE,"UTTAR PRADESH",11,6,2023
TAKHA,Cereals,2023-06-11T12:55:00.127,"Paddy (Dhan)",ETAWAH,5491563,"महोदय 11 जून से 17 जून के बीच 14 से 17 जून को बूंदा-बांदी से हल्की बारिस होने की संभावना है,आंशिक रूप से बादल छाए रहेंगे। आज का न्यूनतम तापमान 34 डिग्री सेल्सियस और अधिकतम तापमान 41 डिग्री सेल्सियस एवं हवा की गति 07 से 22 किलोमीटर प्रति घंटा रहने की संभावना है, मौसम के अनुसार कृषि कार्य को करें|
","Farmer asked query on Weather",Weather,NA,AGRICULTURE,"UTTAR PRADESH",11,6,2023
KAMASIN,Pulses,2023-06-11T12:55:22.527,"Green Gram (Moong Bean/ Moong)",BANDA,5491169,"श्रीमान जी आपके क्षेत्र में 11 जून से 17 जून के बीच प्रत्येक दिन आंशिक रूप से बादल छाए रहने के साथ हल्की बूंदाबांदी की संभावना बनी रहेगी,अधिकतम तापमान 40  डिग्री तथा न्यूनतम 34 डिग्री सेंटीग्रेड है हवाओं की गति 11  से 18 किलोमीटर प्रति घंटा रहने की संभावना है, समस्त कृषि कार्य मौसम के अनुसार करें|
","Farmer asked query on Weather",Weather,NA,AGRICULTURE,"UTTAR PRADESH",11,6,2023
"NATH NAGAR",Others,2023-06-11T12:56:17.47,Others,"SANT KABIR NAGAR",5491802,"श्रीमान जी प्रधानमंत्री किसान सम्मान निधि योजना से संबंधित अधिक जानकारी के लिए आप अपने यहां के राजकीय बीज गोदाम प्रभारी या जिला कृषि उपनिदेशक कार्यालय पर संपर्क करंा या विभाग के नंबर पर संपर्क - 011 - 23381092 , 24300606 करके जानकारी प्राप्त करें","Provide information related to Pradhan Mantri Kisan Samman Nidhi Yojana..?","Government Schemes",NA,AGRICULTURE,"UTTAR PRADESH",11,6,2023
BABINA,Others,2023-06-11T12:59:30.21,Others,JHANSI,5492020,"-किसान क्रेडिट कार्ड से संबंधित किसी भी प्रकार की जानकारी के लिए केवल बैंक से संपर्क करें किसान कॉल सेंटर से इसकी जानकारी नहीं दी जाती है इसको ध्यान में रखें...?","Information related to Kisan Credit Card?","Government Schemes",NA,AGRICULTURE,"UTTAR PRADESH",11,6,2023
GURSARAI,Oilseeds,2023-06-11T12:59:39.413,"Groundnut (pea nut/mung phalli)",JHANSI,5491096,"श्रीमान जी 10 जून से 16 जून तक आपके क्षेत्र में आंशिक रूप से बादल बने रहेंगे आपके क्षेत्र में 17 जून हल्की मध्यम बारिश होने की संभावना है आज का अधिकतम तापमान 40 डिग्री सेंटीग्रेड न्यूनतम तापमान 30 डिग्री सेंटीग्रेड हवा की गति 7 से 18 किलोमीटर प्रति घंटा चलने की संभावना है मौसम के अनुसार कृषि कार्य करें","Farmer asked query on Weather",Weather,NA,AGRICULTURE,"UTTAR PRADESH",11,6,2023
Junawai,Cereals,2023-06-11T12:59:54.39,"Paddy (Dhan)","SAMBAL (BHIM NAGAR)",5491139,"श्रीमान जी, धान की फसल में Pretilachlor 50 % EC , 500 मिलीलीटर प्रति एकड़ 3-4 सेंटीमीटर पानी मे समान रूप से रोपाई बाद 4 दिन के अन्दर छिड़काव करना चाहिए 
","Information about pre emergence weeds control in Paddy
","Weed Management",NA,AGRICULTURE,"UTTAR PRADESH",11,6,2023
GANGOH,Cereals,2023-06-10T21:51:39.363,"Paddy (Dhan)",SAHARANPUR,5482008,"श्रीमान जी धान में खर-पतवार का नियंत्रण के लिए  bispyribac sodium 10%SC 80 मिली/एकर की दर से 200 लीटर पानी में घोल बनाकर स्प्रे करे |","dhan ki nursery me kharpatwar hai kya prayog kare ","Weed Management",NA,AGRICULTURE,"UTTAR PRADESH",10,6,2023
CHANDAUS,Others,2023-06-10T21:59:20.457,Others,ALIGARH,5482672,"श्रीमान जी प्रधानमंत्री किसान सम्मान निधि योजना से संबंधित अधिक जानकारी के लिए आप अपने यहां के राजकीय बीज गोदाम प्रभारी या जिला कृषि उपनिदेशक कार्यालय पर संपर्क करें या कृषि निदेशालय में अधिक जानकारी के लिए विभाग के नंबर पर संपर्क – 1800 180 1488 ,011 – 23381092, 155261  करके जानकारी प्राप्त करें","Tell me about the Pradhan Mantri Kisan Samman Nidhi Yojana ?","Government Schemes",NA,AGRICULTURE,"UTTAR PRADESH",10,6,2023
RAJGARH,Vegetables,2023-06-11T06:09:14.537,"Chapan Kaddu",MIRZAPUR,5491066,"डाईमिथोएट 30 ई.सी. 2 एम एल प्रति लीटर पानी की दर से छिड़काव करें।
","ASKED ABOUT TO INSECT CONTROL ?","	Plant Protection	",NA,HORTICULTURE,"UTTAR PRADESH",11,6,2023
KASMANDA,Others,2023-06-11T06:12:15.37,Others,SITAPUR,5491131,"किसान भाई आपके यहाँ 17 जून में 2-3 मिली मीटर बारिश हो सकती है बाकी दिन कुछ नहीं है आपके यहाँ अधिकतम तापमान 36*c और न्यूनतम तापमान 22*c रहेगा और हवा 4 से 11 किलोमीटर प्रति घंटा की रफ़्तार से चलेगा","Farmer asked query on Weather",Weather,NA,AGRICULTURE,"UTTAR PRADESH",11,6,2023
NAUGARH,Others,2023-06-11T06:13:27.367,Others,CHANDAULI,5491136,"श्रीमान जी, 11 जून से 17 जून तक आंशिक रूप से बादल छाये रहेंगे और हल्की बूंदा - बांदी होने की संभावना है। आज का न्यूनतम तापमान 32°C और अधिकतम तापमान 39°C है और हवा की गति 3-5 किमी / घंटा रहने की संभावना है। मौसम के अनुसार कृषि कार्य करें","Farmer asked query on Weather",Weather,NA,AGRICULTURE,"UTTAR PRADESH",11,6,2023
Amanpur,Others,2023-06-11T06:29:58.767,Others,"KANSHIRAM NAGAR",5490858,"महोदय, 11 जून से 17 जून तक बूंदाबांदी की संभावना है, बादल आंशिक रूप से छाए रहेंगे, आज का न्यूनतम और अधिकतम तापमान 25° C - 40° C  तथा हवा की गति 7 - 11 किलोमीटर प्रति घंटा रहने की संभावना है, मौसम के अनुसार कृषि कार्य करें |","Farmer asked query on Weather",Weather,NA,AGRICULTURE,"UTTAR PRADESH",11,6,2023
UJHANI,"Sugar and Starch Crops",2023-06-11T06:33:06.543,"Sugarcane (Noble Cane)",BADAUN,5491564,"सर आप गन्ने की फसल में वृद्धि के लिए एनपीके 19 19 19   1.5 - 2 किलोग्राम प्रति एकड़ और सागरिका 2.5 से 300ml प्रति एकड़ 200 लीटर पानी में स्प्रे करें","Information about nutrient management in sugarcane crop...?","Nutrient Management",NA,AGRICULTURE,"UTTAR PRADESH",11,6,2023
MAHMUDABAD,"Medicinal and Aromatic Plants",2023-06-11T06:34:10.72,Mentha,SITAPUR,5491793,"श्रीमान जी आपके क्षेत्र में 11 जून से 17 जून के बीच प्रत्येक दिन आंशिक रूप से बादल छाए रहने के साथ हल्की बूंदाबांदी की संभावना बनी रहेगी,अधिकतम तापमान 42  डिग्री तथा न्यूनतम 35 डिग्री सेंटीग्रेड है हवाओं की गति 11  से 18 किलोमीटर प्रति घंटा रहने की संभावना है, समस्त कृषि कार्य मौसम के अनुसार करें|
","Farmer asked query on Weather",Weather,NA,AGRICULTURE,"UTTAR PRADESH",11,6,2023
BILARIYAGANJ,Vegetables,2023-06-11T06:34:11.253,Cucumber,AZAMGARH,5491270,"श्रीमान जी  खीरा की फसल में फूल और फलों की संख्या में वृद्धि के लिए - Gibberellic acid 0.001% - 100 - 120 ML प्रति एकड़ की दर से 100 लीटर पानी में घोल बनाकर स्प्रे करें
","Provide information related to increasing the number of flowers and fruits in cucumber crop ?
","Nutrient Management",NA,HORTICULTURE,"UTTAR PRADESH",11,6,2023
BALDEO,"Fiber Crops",2023-06-11T06:39:43.66,"Cotton (Kapas)",MATHURA,5491839,"श्रीमान जी मौसम की जानकारी 11 जून से लेकर के 17 जून तक है पूरे सप्ताह आंशिक रूप से बादल बने रहेंगे जिसमें 16 जून को बूँदा बाँदी  के साथ हल्की वर्षा होने की संभावना है आज का न्यूनतम तापमान 33 डिग्री सेल्सियस अधिकतम 41 डिग्री सेल्सियस हवा की गति 18 किलोमीटर प्रति घंटा से चलने की संभावना है | ","Farmer asked query on Weather",Weather,NA,AGRICULTURE,"UTTAR PRADESH",11,6,2023
"NEBUA NAURANGIA","Sugar and Starch Crops",2023-06-11T06:44:11.213,"Sugarcane (Noble Cane)","KUSHI NAGAR",5487756,"श्रीमान जी, Copper oxychloride 50% WP @ 500 ग्राम प्रति एकड़ 200 लीटर पानी के साथ घोल बनाकर छिड़काव करें |
","Information about the control of Pokkahboing disease in Sugarcane crop
","	Plant Protection	",NA,AGRICULTURE,"UTTAR PRADESH",11,6,2023
