BlockName,Category,CreatedOn,Crop,DistrictName,KCCCallID,KccAns,QueryText,QueryType,Season,Sector,StateName,day,month,year
BINAULI,"Sugar and Starch Crops",2023-06-11T15:25:48.02,"Sugarcane (Noble Cane)",BAGHPAT,5492281,"श्रीमान जी, गन्ने में शीर्ष बेधक के नियंत्रण हेतु- कार्बोफुरान 3 G @ 8- 10 किग्रा /एकड़ की दर से प्रयोग करे |
","Information about controlling top borer in Sugarcane...?","	Plant Protection	",NA,AGRICULTURE,"UTTAR PRADESH",11,6,2023
BILSANDA,"Sugar and Starch Crops",2023-06-11T15:28:06.83,"Sugarcane (Noble Cane)",PILIBHIT,5490995,"महोदय, आपके क्षेत्र में आज दिनांक 11 जून से लेकर 17 जून तक आंशिक रूप से हल्के व मध्यम बादल छाए रहेंगे इस बीच हल्की बूंदाबांदी बारिश की भी संभावना है दिन का अधिकतम तापमान 42 डिग्री सेल्सियस न्यूनतम तापमान 30 डिग्री सेल्सियस तक रह सकता है हवा की गति 04 - 07 किलोमीटर प्रति घंटे की रफ्तार से चल सकती हैं अतः मौसम को ध्यान में रखकर कृषि कार्य कीजिए । ","Farmer asked query on Weather",Weather,NA,AGRICULTURE,"UTTAR PRADESH",11,6,2023
ASAFPUR,"Medicinal and Aromatic Plants",2023-06-11T15:28:33.49,Mentha,BADAUN,5490991,"श्रीमान जी 11 जून से 17 जून तक की मौसम की जानकारी दी जा रही है जिसमें आपके यहां पूरे सप्ताह हल्के-फुल्के बादल और हल्की-फुल्की बूंदाबांदी होने की संभावना है आज का न्यूनतम तापमान 30 डिग्री सेंटीग्रेड अधिकतम 36 डिग्री सेंटीग्रेड हवा की गति 11 से 22 किलोमीटर प्रति घंटा चलने की संभावना है महोदय कृषि कार्य मौसम के अनुसार करें
","Farmer asked query on Weather",Weather,NA,AGRICULTURE,"UTTAR PRADESH",11,6,2023
CHIRAIGAON,Others,2023-06-11T15:32:12.653,Others,VARANASI,5490833,"श्रीमान जी पीएम- किसान सम्मान निधि योजना मे जिले के अनुरोध पर राज्य द्वारा पहली किश्त का भुगतान रोका गया |","Information about PM- Kisan Samman Nidhi Yojana (PM- KSNY) .....?	","Government Schemes",NA,AGRICULTURE,"UTTAR PRADESH",11,6,2023
LOTAN,Others,2023-06-11T15:34:20.933,Others,"SIDDHARTH NAGAR",5492233,"महोदय   11-17 जून के मध्य आपके यहां हल्के- हल्के आंशिक बादल और हल्की बूंदा-बांदी की संभावना है/ आज का न्यूनतम तापमान 27 डिग्री सेल्सियस और अधिकतम तापमान 40-42  डिग्री सेल्सियस के मध्य है, हवा की गति 12-15 किमी / घंटा रहने की संभावना है। कृपया  मौसम के अनुसार कृषि कार्य करें /","Farmer asked query on Weather",Weather,NA,AGRICULTURE,"UTTAR PRADESH",11,6,2023
CHILKAHAR,Cereals,2023-06-11T15:45:01.63,"Paddy (Dhan)",BALLIA,5491376," श्रीमान जी 11 जून से 17 जून के बीच पूरे सप्ताह कहीं-कहीं हल्के बादल रहने की संभावना है 12 तथा 14 जून को हल्की छिटपुट बूंदाबांदी हो सकती है आज का न्यूनतम तापमान 36 °C तथा अधिकतम तापमान 42°C एवं हवा की गति 18 किलोमीटर प्रति घंटा रहने की संभावना है मौसम के अनुसार कृषि कार्य को करें","Farmer asked query on Weather",Weather,NA,AGRICULTURE,"UTTAR PRADESH",11,6,2023
SAKIT,Vegetables,2023-06-11T15:45:37.617,Cabbage,ETAH,5492062,"महोदय पत्ता गोभी की अगेती नर्सरी मध्य सितंबर से  बुवाई कर सकते हैं","Information about sowing time of cabbage nursery ..?","Vegetative Propagation and Tissue Culture",NA,HORTICULTURE,"UTTAR PRADESH",11,6,2023
HARGAON,"Sugar and Starch Crops",2023-06-11T15:47:54.197,"Sugarcane (Noble Cane)",SITAPUR,5491340,"गन्ने की फसल मे जड़ बेदक कीट की रोकथाम के लिए कार्बोफ्यूरान 3 जी 8 किग्रा प्रति एकड़ प्रयोग करे |","insect control in sugarcane crop ?","	Plant Protection	",NA,AGRICULTURE,"UTTAR PRADESH",11,6,2023
BALDIRAI,Others,2023-06-11T15:48:53.74,Others,SULTANPUR,5491618,"
श्रीमान जी प्रधानमंत्री किसान सम्मान निधि योजना से संबंधित अधिक जानकारी के लिए आप अपने यहां के राजकीय बीज गोदाम प्रभारी या
जिला कृषि उपनिदेशक कार्यालय पर संपर्क करें या विभाग के नंबर पर संपर्क - 011 – 23381092, 011-24300606 ,18001801488, 155261 करके जानकारी प्राप्त करें","Tell me about the Pradhan Mantri Kisan Samman Nidhi Yojana ?","Government Schemes",NA,AGRICULTURE,"UTTAR PRADESH",11,6,2023
DAMKHAUDA,"Medicinal and Aromatic Plants",2023-06-11T15:51:09.29,Mentha,BAREILLY,5492175,"प्रिय महोदय 11-17 जून के बीच आंशिक रूप से बादल बादल छाए रहेंगे। 11,14,15,16,17 जून को [0.2-2 मिलीमीटर] की हल्की वर्षा होने की सम्भावना है आज का न्यूनतम तापमान 31 डिग्री सेल्सियस और अधिकतम तापमान 38 डिग्री सेल्सियस और हवा की गति 11-25 किलोमीटर प्रति घंटा रहने की उम्मीद है मौसम के अनुसार कृषि कार्य करें ","Farmer asked query on Weather",Weather,NA,AGRICULTURE,"UTTAR PRADESH",11,6,2023
KOTWALI,Others,2023-06-11T15:52:08.4,Others,BIJNOR,5492065,"--श्रीमान जी पीएम किसान सम्मान निधि की पहली किस्त आपकी राज्य सरकार के अनुमोदन के द्वारा जिले स्तर से प्रतीक्षारत है कृपया इंतजार करें जल्दी आपके खाते में आने की उम्मीद जताई जा रही है |","Information about of pm kisan samman nidhi yojna ...?","Government Schemes",NA,AGRICULTURE,"UTTAR PRADESH",11,6,2023
BAKSHI-KA-TALAB,Cereals,2023-06-11T15:53:09.177,"Paddy (Dhan)",LUCKNOW,5491197,"श्रीमान जी Imidacloprid 17.8 %SL, @ 100 मिली प्रति एकड़ की दर से 200 लीटर पानी के साथ घोल बनाकर छिड़काव करें","information about insect in paddy crop ?","	Plant Protection	",NA,AGRICULTURE,"UTTAR PRADESH",11,6,2023
KHARKHODA,Cereals,2023-06-11T15:54:36.693,"Paddy (Dhan)",MEERUT,5491069,"श्रीमान जी धान  पौध की जड़ को शोधित करने के लिए कॉपर ऑक्सिक्लोराइड 50% डब्ल्यूपी 5 से 7 ग्राम प्रति लीटर पानी में घोलकर नर्सरी से पौधा निकालने के बाद उसी  जड़ को 5 मिनट तक भिगोकर रखें तत्पश्चात खेत में रोपाई करते हैं.","Root treatment in Paddy nursery..?","	Plant Protection	",NA,AGRICULTURE,"UTTAR PRADESH",11,6,2023
JHANJHARI,Others,2023-06-11T15:56:48.203,Others,GONDA,5491526,"श्रीमान जी, प्रधानमंत्री किसान सम्मान निधि योजना की 8वीं किस्त आपके बैंक खाते में 27/02/2023 को ₹2000 की धनराशि सफलतापूर्वक भेज दी गई, धनराशि आपके बैंक ऑफ बड़ौदा में भेजी गई, कृपया बैंक जाकर जानकारी प्राप्त करें|
","Information about PM Kisan Samman Nidhi Beneficiary Status…?
","Government Schemes",NA,AGRICULTURE,"UTTAR PRADESH",11,6,2023
DATAGANJ,Others,2023-06-11T15:59:05.967,Others,BADAUN,5491710,"
महोदय प्रधानमंत्री किसान सम्मान निधि के अंतर्गत आप विशेष जानकारी के लिए  अपने जिले के जिला कृषि उपनिदेशक अधिकारी कार्यालय या कृषि विभाग के ब्लॉक पर संपर्क करें 
पीएम-किसान हेल्पलाइन नंबर -   155261/011-24300606 
अभी तक आपको 12th  किस्तों का लाभ प्राप्त हुआ है /
","Information about pm kisan samman nidhi status ? ","Government Schemes",NA,AGRICULTURE,"UTTAR PRADESH",11,6,2023
MAUAIMA,Others,2023-06-11T16:00:22,Others,ALLAHABAD,5491041,"श्रीमान जी आपके क्षेत्र में 11 जून से 17 जून तक मौसम की जानकारी मे पूरे सप्ताह हल्की बूंदाबांदी के साथ-साथ हल्की बारिश होने की संभावना है भारी बारिश होने की कोई संभावना नहीं है आपके क्षेत्र का आज का अधिकतम तापमान 41 डिग्री सेल्सियस न्यूनतम 31 डिग्री सेल्सियस है हवाएँ आपके क्षेत्र में 7 से 29 किलोमीटर प्रति घंटे के बीच में रहने की संभावना है आप मौसम के अनुसार कृषि कार्य करें |
","Farmer asked query on Weather",Weather,NA,AGRICULTURE,"UTTAR PRADESH",11,6,2023
JAKHAURA,Oilseeds,2023-06-11T16:00:32.78,"Groundnut (pea nut/mung phalli)",LALITPUR,5492140,"महोदय आपके क्षेत्र में आज से 17 जून तक आंशिक रूप से बादल छाए रहेंगे 12-17 जून को आपके क्षेत्र में हल्की बूंदाबांदी की संभावना है इस दौरान आपके क्षेत्र का न्यूनतम तापमान 30 डिग्री सेंटीग्रेड अधिकतम तापमान 42 डिग्री सेंटीग्रेड तक रहेगा हवा की गति 11 से 25 किलोमीटर प्रति घंटा रहेगी
","Farmer asked query on Weather",Weather,NA,AGRICULTURE,"UTTAR PRADESH",11,6,2023
SORAON,Fruits,2023-06-11T16:00:37.68,Mango,ALLAHABAD,5492066,"श्रीमान जी, आम के पौधे में क्लोरपीरिफॉस 20%EC 1 लीटर प्रति एकड़ बालू में मिलाकर प्रयोग करें |","Termite Management in Mango Plant...?","	Plant Protection	",NA,HORTICULTURE,"UTTAR PRADESH",11,6,2023
HOLAGARH,Cereals,2023-06-11T16:07:17.65,"Paddy (Dhan)",ALLAHABAD,5491124,"महोदय 11 – 17 जून  के बीच हलकी बूंदा बांदी होने की सम्भावना है आंशिक रूप से बादल छाए रह सकते हैं आज का अधिकतम तापमान 42 °C और न्यूनतम तापमान 30 °C एवं हवा की गति 7 - 25 किलोमीटर प्रति घंटा रहने की सम्भावना है मौसम के अनुसार कृषि कार्य को करें","Farmer asked query on Weather",Weather,NA,AGRICULTURE,"UTTAR PRADESH",11,6,2023
DATAGANJ,Others,2023-06-11T16:07:27.273,Others,BADAUN,5491709,"श्रीमान जी प्रधानमंत्री किसान सम्मान निधि योजना में आपका आवेदन हो चुका है और आपके खाते में 2000 रुपया की 11 किस्त ट्रांसफर कर दी गई हैं 11वीं  किस्त 27/02/2023 को ट्रांसफर की गई है आप बैंक खाते का स्टेटस चेक करे","give information about the application status in PM-Kisan Samman Nidhi Yojana.","Government Schemes",NA,AGRICULTURE,"UTTAR PRADESH",11,6,2023
BHATHAT,Vegetables,2023-06-11T16:07:55.48,Bhindi(Okra/Ladysfinger),GORAKHPUR,5491250,"श्रीमान जी 11 से 17 जून तक आपके यहां हल्के-फुल्के बादल के साथ हल्की फुल्की बूंदाबांदी लगभग (0.03-0.08mm) होने की संभावना है अधिकतम तापमान 41 डिग्री सेंटीग्रेड न्यूनतम तापमान 25 डिग्री सेंटीग्रेड हवा की गति 7 से 22 किलोमीटर प्रति घंटा एवं हवा की दिशा उत्तरी पूर्वी एवं उत्तरी पश्चिमी रहने की संभावना है अतः कृषि कार्य मौसम के अनुसार करें","Farmer asked query on Weather",Weather,NA,HORTICULTURE,"UTTAR PRADESH",11,6,2023
SHIVPUR,"Sugar and Starch Crops",2023-06-11T16:11:19.45,"Sugarcane (Noble Cane)",BAHRAICH,5492160,"मौसम का पूर्वानुमान आपके क्षेत्र में 17 जून तक हल्की बूंदाबांदी होने की संभावना है न्यूनतम तापमान 39 डिग्री सेल्सियस अधिकतम तापमान 41  डिग्री सेल्सियस रहने की संभावना है हवाओं की गति 22 किलोमीटर प्रति घंटे की हो सकती है मौसम के अनुसार कृषि कार्य करें","Farmer asked query on Weather",Weather,NA,AGRICULTURE,"UTTAR PRADESH",11,6,2023
SHAHABAD,Others,2023-06-11T16:12:10.18,Others,RAMPUR,5492073,"श्रीमान जी, प्रधानमंत्री किसान सम्मान निधि योजना संबंधित अधिक जानकारी के लिए आप अपने ब्लॉक पर राजकीय बीज भंडार प्रभारी जी या अपने जनपद पर जिला कृषि उप निदेशक कार्यालय में संपर्क करें| या प्रधानमंत्री किसान सम्मान निधि योजना संबंधित अधिक जानकारी हेतु-155261, 011-24300606 पर संपर्क करे|
","Information about PM Kisan Samman Nidhi Beneficiary Status…?
","Government Schemes",NA,AGRICULTURE,"UTTAR PRADESH",11,6,2023
BEWAR,Millets,2023-06-11T16:12:29.04,"Maize (Makka)",MAINPURI,5490827,"
श्रीमान जी आपके  क्षेत्र में 11 जून से 17 जून तक पूरे सप्ताह आंशिक रूप से बादल छाए रहेंगे  ,13 जून से 17 जून के बीच प्रतिदिन हल्की बूंदाबांदी की संभावना है,आज का अधिकतम तापमान 39°C ,न्यूनतम तापमान 30°C, हवाएं आपके क्षेत्र में  07 से 22 किलोमीटर प्रति घंटे की रफ्तार से चलने की संभावना है मौसम के अनुसार कृषि कार्य करें |
","Farmer asked query on Weather",Weather,NA,AGRICULTURE,"UTTAR PRADESH",11,6,2023
PHOOLBEHAR,Cereals,2023-06-11T16:13:38.867,"Paddy (Dhan)",KHERI,5492347,"महोदय आपके  यहाँ  11 जून – 17 जून  तक  जानकारी दे रहे है|,जिसमे आपके  यहाँ  11,12,13,14,15,16,17 जून  को  हल्की बूंदा -बांदी होने  की  संभावना  है|,लेकिन  आंशिक  रूप  से  बादल  छाये  रहेंगे|,आज  का  आपेक्षित  अधिकतम  तापमान  ( 42°C  और  न्यूनतम  तापमान  33°C और  हवा  की  गति  07-14 किलोमीटर  / घंटा  ) चलने  की  संभावना  है| ,और आप मौसम के अनुसार कृषि कार्य को  करे|
","Farmer asked query on Weather",Weather,NA,AGRICULTURE,"UTTAR PRADESH",11,6,2023
SAKALDIHA,Vegetables,2023-06-11T16:17:07.533,Bhindi(Okra/Ladysfinger),CHANDAULI,5492076,"महोदय भिंडी की फसल के लिए उन्नतशील प्रजातियां- परभनी क्रांति, काशी विभूति, काशी भैरव, आईआईवीआर 10, काशी महिमा","information about variety of okra","Seeds and Planting Material",NA,HORTICULTURE,"UTTAR PRADESH",11,6,2023
CHIRAIGAON,Others,2023-06-11T16:17:22.167,Others,VARANASI,5490832," श्रीमान जी, प्रधानमंत्री किसान सम्मान निधि योजना के पंजीकरण में संशोधन के लिए आपके ग्राम पंचायत भवन में लगने वाले पीएम किसान समाधान शिविर में संपर्क करें |","Information about of PM Kisan samman nidhi scheme..?","Government Schemes",NA,AGRICULTURE,"UTTAR PRADESH",11,6,2023
BAHERI,"Sugar and Starch Crops",2023-06-11T16:20:33.593,"Sugarcane (Noble Cane)",BAREILLY,5491179,"श्रीमान जी आप गन्ना की बुवाई के 45 दिन बाद यूरिया 35 किलोग्राम/एकड़,सागरिका 10 किलोग्राम/एकड़ ,मोनो ज़िंक 6 किलोग्राम/एकड़ या माइक्रो नुट्रिएंट 10 किलोग्राम/एकड़ की दर से प्रयोग करे ","Give Information about the first top dressing fertilizer used in sugarcane.","Fertilizer Use and Availability",NA,AGRICULTURE,"UTTAR PRADESH",11,6,2023
Bhadurpur,Others,2023-06-11T16:21:56.133,Others,"AMETHI ( Shahu Ji Maharaj)",5491289,"महोदय,  11 जून से 17 जून तक बूंदाबांदी की संभावना है, बादल आंशिक रूप से छाए रहेंगे, आज का न्यूनतम और अधिकतम तापमान 25° C - 40° C  तथा हवा की गति 7 - 11 किलोमीटर प्रति घंटा रहने की संभावना है, मौसम के अनुसार कृषि कार्य करें |
","Farmer asked query on Weather",Weather,NA,AGRICULTURE,"UTTAR PRADESH",11,6,2023
BIKAPUR,Others,2023-06-11T16:23:10.36,Others,FAIZABAD,5490918,"श्रीमान जी,आप प्रधानमंत्री किसान सम्मान निधि योजना का स्टेटस जानने के लिए दिए गए नंबर 011-24300606/155261,1800115526,18001801488 पर संपर्क करे |
","Information about the beneficiary status of Pm Kisan Samman Nidhi Yojana..?
","Government Schemes",NA,AGRICULTURE,"UTTAR PRADESH",11,6,2023
PATEHRA,Cereals,2023-06-11T16:25:16.3,"Paddy (Dhan)",MIRZAPUR,5491213,"श्रीमान जी 11 जून से 17 जून के बीच पूरे सप्ताह हल्के बादल रहने की संभावना है 12,14 तथा 17 जून को हल्की छिटपुट बूंदाबांदी हो सकती है आज का न्यूनतम तापमान 33 °C तथा अधिकतम तापमान 40°C एवं हवा की गति 14 किलोमीटर प्रति घंटा रहने की संभावना है मौसम के अनुसार कृषि कार्य को करें ","Farmer asked query on Weather",Weather,NA,AGRICULTURE,"UTTAR PRADESH",11,6,2023
JAITPUR,"Medicinal and Aromatic Plants",2023-06-11T16:25:26.533,Mentha,SHAHJAHANPUR,5491413,"श्रीमान जी  14  15 16 17 जून   हल्के  बादल छाए रहेंगे हल्की बूंदाबांदी देखी जा रही है  11 12 13  जून मौसम साफ रहने की संभावना है आज का न्यूनतम तापमान 28° C औरअधिकतम तापमान 40 ° C एवं हवा की गति 22 किलोमीटर प्रति घंटा रहने की संभावना है  मौसम के अनुसार कृषि कार्य को करे |","Farmer asked query on Weather",Weather,NA,AGRICULTURE,"UTTAR PRADESH",11,6,2023
GOSAIGANJ,Others,2023-06-11T16:32:20.48,Others,LUCKNOW,5492082,"महोदय जी धान की प्रजाति से संबंधित कंपनी को शिकायत करें","information about seed quality problem ? ",Seeds,NA,AGRICULTURE,"UTTAR PRADESH",11,6,2023
BISWAN,"Medicinal and Aromatic Plants",2023-06-11T16:33:35.47,Mentha,SITAPUR,5491064,"श्रीमान जी 11 से 17 जून तक आपके यहां हल्के-फुल्के बादल के साथ हल्की फुल्की बूंदाबांदी लगभग (0.03-0.18mm) होने की संभावना है अधिकतम तापमान 39 डिग्री सेंटीग्रेड न्यूनतम तापमान 25 डिग्री सेंटीग्रेड हवा की गति 7 से 22 किलोमीटर प्रति घंटा एवं हवा की दिशा उत्तरी पूर्वी एवं उत्तरी पश्चिमी रहने की संभावना है अतः कृषि कार्य मौसम के अनुसार करें","Farmer asked query on Weather",Weather,NA,HORTICULTURE,"UTTAR PRADESH",11,6,2023
KHEKRA,Others,2023-06-11T16:34:26.763,Others,BAGHPAT,5492084,"--श्रीमान जी आप जो सिंचाई विभाग से जो भी संबंधित जानकारी चाहते हैं उसके लिए अपने जिले में कृषि भवन कृषि निदेशक कार्यालय संपर्क करें |","Information about of  Government Schemes ...?","Government Schemes",NA,AGRICULTURE,"UTTAR PRADESH",11,6,2023
SURSA,Others,2023-06-11T16:34:52.253,Others,HARDOI,5491207,"सोलर पंप स्कीम के लिए उत्तर प्रदेश किसान कॉल सेंटर में कॉल करें |","information about solar pannel scheme?","Government Schemes",NA,AGRICULTURE,"UTTAR PRADESH",11,6,2023
