BlockName,Category,CreatedOn,Crop,DistrictName,KCCCallID,KccAns,QueryText,QueryType,Season,Sector,StateName,day,month,year
MANGALVEDHE,Millets,2025-06-01T06:20:54.59,"Maize (Makka)",SOLAPUR,4434643,"हवामान विभागाच्या अंदाजानुसार सोलापूर जिल्हा, मंगळवेढे तालुक्यामध्ये वातावरण ढगाळ राहील पावसाची शक्यता फार कमी आहे. तापमान कमाल ३४ डिग्री सेल्सिअस व किमान तापमान २४ डिग्री सेल्सिअस राहील. वाऱ्याचा वेग ताशी ११ किलोमीटर राहील. हवामान विभागाच्या अंदाजानुसार मका पिकासाठी मशागतीचे नियोजन करू शकता धन्यवाद. ","Farmer asked query on Weather","	Field Preparation	",NA,AGRICULTURE,MAHARASHTRA,1,6,2025
PANDHARPUR,Oilseeds,2025-06-01T13:22:44.827,"Soybean (bhat)",SOLAPUR,4434700,"नमस्कार सर, हवामान विभागाच्या अंदाजानुसार आपल्या सोलापूर जिल्ह्यातील पंढरपूर तालुक्यात पुढील पाचही दिवस वातावरण ढगाळ असेल. हलक्या पावसाची शक्यता दाखवलेली आहे. जास्तीत जास्त तापमान  ३२ अंश सेल्सिअस, कमीत कमी तापमान २६ अंश सेल्सिअस व वाऱ्याचा वेग १४  किमी प्रति तास असेल. या हवामान विभागाच्या अंदाजानुसार आपण आपल्या सोयाबीन पिकाच्या पेरणीचे नियोजन करू शकता धन्यवाद","Farmer asked query on Weather","Sowing Time and Weather",NA,AGRICULTURE,MAHARASHTRA,1,6,2025
AKKALKOT,Others,2025-06-01T13:33:30.653,Others,SOLAPUR,4434478,"नमस्कार सर हवामान विभागाच्या अंदाजानुसार सोलापूर  जिल्हा अक्कलकोट  तालुक्यामध्ये वातावरण पुढील पाचही दिवस ढगाळ राहील हलका ते तुरळक पावसाची शक्यता पुढील पाचही दिवस दाखवलेली आहे जास्तीत जास्त तापमान ३१ डिग्री सेल्सियस कमीत कमी तापमान २४ डिग्री सेल्सिअस राहील वाऱ्याचा वेग ७ ते११ किलोमीटर प्रतिताशी राहील या हवामान अंदाजानुसार जमीन मशागतीचे  नियोजन करावे धन्यवाद","Farmer asked query on Weather","	Field Preparation	",NA,AGRICULTURE,MAHARASHTRA,1,6,2025
KARMALA,Millets,2025-06-01T13:48:40.023,"Pearl Millet (Bajra/Bulrush Millet/Spiked Millet)",SOLAPUR,4434578,"नमस्कार सर हवामान विभागाच्या अंदाजानुसार सोलापूर  जिल्हा करमाळा  तालुक्यामध्ये वातावरण पुढील पाचही दिवस ढगाळ राहील हलका ते तुरळक पावसाची शक्यता पुढील पाचही दिवस दाखवलेली आहे जास्तीत जास्त तापमान ३३ डिग्री सेल्सियस कमीत कमी तापमान २४ डिग्री सेल्सिअस राहील वाऱ्याचा वेग ११ ते१४ किलोमीटर प्रतिताशी राहील या हवामान अंदाजानुसार पेरणीचे  नियोजन करावे धन्यवाद","Farmer asked query on Weather","Cultural Practices",NA,AGRICULTURE,MAHARASHTRA,1,6,2025
"SOLAPUR NORTH",Others,2025-06-01T16:36:56.177,Others,SOLAPUR,4434746,"नमस्कार, शेतकरी ओळखपत्र क्रमांक मिळण्यासाठी आपण जवळच्या महा-ई-सेवा केंद्र शी संपर्क करा किंवा ऍग्री स्टॅक वेबसाईटला भेट द्या. धन्यवाद!","FARMER ASKED INFORMATION ABOUT FARMER ID?","Government Schemes",NA,AGRICULTURE,MAHARASHTRA,1,6,2025
MANGALVEDHE,Fruits,2025-06-02T10:35:13.727,Pomegranate,SOLAPUR,4441172,"शेतकरी साहेब, नाशिक जिल्हा चांदवड तालुक्यात दि.02 ते 06 जून दरम्यानचे हवामान अंदाज- अंशतः ढगाळमय वातावरणासह सूर्यप्रकाश असेल, पाऊस पडला तर तुरळक-हलका पडेल. किमान तापमान 24° से. आणि कमाल तापमान 34° से. पर्यंत असेल. वाऱ्याचा वेग ताशी 11 -14 कि.मी. व आद्रता 28 ते 60 % दरम्यान राहण्याची शक्यता आहे. या अंदाजानुसार डाळिंब पिकाचे  नियोजन करावे ,धन्यवाद....!","Farmer asked query on Weather",Weather,NA,AGRICULTURE,MAHARASHTRA,2,6,2025
MANGALVEDHE,Millets,2025-06-02T10:45:28.31,"Maize (Makka)",SOLAPUR,4441616,"महोदय,  हवामान विभागाच्या अंदाजानुसार आपल्या सोलापूर जिल्हा मंगळवेढा तालुक्यात 01 जून ते 05 जून 2025 वातावरण अंशतः ढगाळ असेल,  हलक्या पावसाची शक्यता आहे. कमाल तापमान 35 अंश सेल्सिअस,  किमान तापमान 23 अंश सेल्सिअस, वाऱ्याचा वेग सरासरी 11 ते 14 किलोमीटर प्रतितास असेल. हवामान विभागाच्या अंदाजानुसार मका पिकाची लागवड करावी. धन्यवाद.","Farmer asked query on Weather","Cultural Practices",NA,AGRICULTURE,MAHARASHTRA,2,6,2025
SANGOLA,Others,2025-06-02T13:53:24.197,Others,SOLAPUR,4441638,"नमस्कार, प्रधानमंत्री फसल बीमा योजना अंतर्गत पिक विम्याची माहिती तपासण्या करता आपल्याकडून योग्य ती माहिती न मिळाल्याने आपले स्टेटस चे होऊ शकत नाही. कृपया आपले आधार कार्ड आणि आधार कार्ड ला लिंक असणारा मोबाईल जवळ असताना कॉल करा. धन्यवाद!","Farmer asked information about the crop insurance amount under the Prime Minister's Fasal Beema Yojana?","Government Schemes",NA,AGRICULTURE,MAHARASHTRA,2,6,2025
"SOUTH  SOLAPUR",Pulses,2025-06-02T14:33:24.36,"Pigeon pea (red gram/arhar/tur)",SOLAPUR,4441587,"महोदय, हवामान खात्याच्या अंदाजानुसार, तुमच्या दक्षिण सोलापूर  तालुकामध्ये हलक्या ते मध्यम पाऊस पडण्याची शक्यता आहे, अंशतः ढगाळ वातावरण असेल. किमान तापमान २४ अंश सेल्सिअस आणि कमाल तापमान - ३५ अंश सेल्सिअस राहण्याची शक्यता आहे आणि वाऱ्याचा वेग ताशी - १४ किलोमीटर राहण्याची शक्यता आहे. हवामान अंदाजानुसार आपल्या तूर पिकाची पेरणी  नियोजन करावे धन्यवाद","Farmer asked query on Weather","Sowing Time and Weather",NA,AGRICULTURE,MAHARASHTRA,2,6,2025
SANGOLA,Pulses,2025-06-02T16:12:25.843,"Pigeon pea (red gram/arhar/tur)",SOLAPUR,4438867,"नमस्कार सर हवामान विभागाच्या अंदाजानुसार  सोलापूर जिल्हा सांगोला तालुक्यात  ,या आठवड्यामध्ये वातावरण अंशतः ढगाळ राहील,हलक्या  पावसाची शक्यता   आहे .आजचे तापमान  कमाल -34 अंश सेल्सियस आणि किमान -25 अंश सेल्सियस ,वाऱ्याचा वेग -ताशी 18 किलोमीटर आहे.हवामान अंदाजानुसार तुर पिकाची काढणी व्यवस्थापन नियोजन करावे धन्यवाद  ","Farmer asked query on Weather",Weather,NA,AGRICULTURE,MAHARASHTRA,2,6,2025
AKKALKOT,Vegetables,2025-06-02T16:46:13.603,Onion,SOLAPUR,4441133,"कांदा बीज प्रक्रिया - पेरणीपूर्वी प्रतिकिलो बियाणास २.५ ते ३ ग्रॅम थायरम किंवा कॅप्टन किंवा कार्बेन्डाझिमची प्रक्रिया करावी.","Farmer asked about Onion Seed Treatment Information ?","Seeds and Planting Material",NA,HORTICULTURE,MAHARASHTRA,2,6,2025
AKKALKOT,Others,2025-06-03T08:47:24.197,Others,SOLAPUR,4450309,"हवामान विभागाच्या अंदाजानुसार अकोलकोट   तालुक्यात, या आठवड्यामध्ये वातावरण अंशतः ढगाळ राहील, पावसाची शक्यता आहे  .तापमान  कमाल ३५ अंश सेल्सियस आणि किमान - २९ अंश सेल्सियस, वाऱ्याचा वेग ताशी - १४ किलोमीटर आहे. हवामान अंदाजानुसार पेरणी, खत व्यवस्थापन, पीक संरक्षण, सिंचन आदी बाबींचे नियोजन करा.  ","Farmer asked query on Weather",Weather,NA,AGRICULTURE,MAHARASHTRA,3,6,2025
"SOUTH  SOLAPUR",Others,2025-06-03T09:54:20.613,Others,SOLAPUR,4450684,"नमस्कार शेतकरी साहेब, इफको प्रायव्हेट लिमिटेड यांचा टोल फ्री नंबर १८००-१०३-१९६७  हा असून त्याच्यावरती आपण संपर्क करून खताच्या संदर्भात खतांच्या किमतीच्या संदर्भात चौकशी करू शकता. धन्यवाद...!","FARMER ASKED ABOUT PRICES OF FERTILIZERS?","Fertilizer Use and Availability",NA,AGRICULTURE,MAHARASHTRA,3,6,2025
MADHA,Pulses,2025-06-03T11:07:26.057,"Black Gram (urd bean)",SOLAPUR,4450415,"उडीद पिकामध्ये टर्गा सुपर  क्विझालो फॉफ इथाइल तण नाशक (5 टक्के ईसी) 15 ते 20 मि.लि. /10 लिटर (750मिली-1लिटर प्रति 500 लिटर पाणी प्रति  हेक्टरी ) पाण्यात मिसळून पीक उगवणीनंतर 21 दिवसांनी फवारावे. 
","ASKED ABOUT WEED MANAGEMENT IN  BLACK GRAM ?
","Weed Management",NA,AGRICULTURE,MAHARASHTRA,3,6,2025
"SOLAPUR NORTH",Others,2025-06-03T12:23:28.113,Others,SOLAPUR,4450514,"किसान सन्मान निधी योजनेची पुढील हप्त्याची तारीख जाहीर झालेली नाही","asked about kisan sanman nidhi next installment information ?","Government Schemes",NA,AGRICULTURE,MAHARASHTRA,3,6,2025
MADHA,Others,2025-06-03T14:37:21.773,Others,SOLAPUR,4450238,"महोदय, हवामान खात्याच्या अंदाजानुसार, तुमच्या सोलापूर जिल्हा माढा तालुक्या मध्ये हलका पाऊस पडण्याची शक्यता आहे .अंशतः ढगाळ वातावरण असेल. किमान तापमान .२२ अंश सेल्सिअस आणि कमाल तापमान – 31 अंश सेल्सिअस राहण्याची शक्यता आहे आणि वाऱ्याचा वेग ताशी - २६ किलोमीटर राहण्याची शक्यता आहे. आद्रता - ५७ % राहील ..हवामान विभागाच्या अंदाजानुसार पेरणी , पिकास पाणी ,खत व्यवस्थापन , तण व्यवस्थापन याचे योग्य नियोजन करावे धन्यवाद","Farmer asked query on Weather",Weather,NA,AGRICULTURE,MAHARASHTRA,3,6,2025
BARSHI,Others,2025-06-03T15:34:31.587,Others,SOLAPUR,4450732,"ॲग्री स्टॅक अधिक माहितीसाठी आपल्या गावचे ग्राम महसूल अधिकारी किंवा कृषी सहाय्यक यांच्याशी संपर्क करा किंवा हेल्पलाइन क्रमांक ०२० २५ ७१२७१२ वर फोन करा.","asked about Agristack Maharashtra Farmer Registration ","Government Schemes",NA,AGRICULTURE,MAHARASHTRA,3,6,2025
MOHOL,Millets,2025-06-03T15:48:12.28,"Pearl Millet (Bajra/Bulrush Millet/Spiked Millet)",SOLAPUR,4450733,"--बाजरी मका आणि ज्वारी पिकामध्ये 2,4-D हे तणनाशक 20 लिटरच्या पंपासाठी 40 ते 45 मिली प्रमाण घेऊन दाट फवारणी करावी पीक पेरणी केल्यानंतर 21 दिवसानंतर आपण याची फवारणी करावी धन्यवाद","Farmer asked which fungicide used in bajara ?","Weed Management",NA,AGRICULTURE,MAHARASHTRA,3,6,2025
BARSHI,Oilseeds,2025-06-03T15:52:46.19,"Soybean (bhat)",SOLAPUR,4450825,"शेतकरी साहेब, सोयाबीन पिकाच्या सुधारित जाती-लवकर येणारा वाण : परभणी सोना (MAUS-47), ग्रीन गोल्ड ३३४४, विक्रांत, जे एस ९५-६०. मध्यम कालावधीत येणारा वाण :  फुले किमया (KDS-753),फुले दुर्वा (KDS-992), शक्ती (MAUS-81),जे एस ९३-०५ ,फुले कल्याणी (KDS-228) , समृद्धी (MAUS-71),जे एस - ३३५. अति उशिरा येणारा वाण : MAUS-१६२, फुले संगम (KDS-726),फुले अग्रणी (KDS-344), MACS-११८८. धन्यवाद..!","FARMER ASKED ABOUT WHICH VARIETY IS BEST SUTAIBLE FOR SOYABIN CROP PRODUCTION ?",Varieties,NA,AGRICULTURE,MAHARASHTRA,3,6,2025
BARSHI,Oilseeds,2025-06-03T16:06:43.98,"Soybean (bhat)",SOLAPUR,4450184,"न फुटणारी नवीन सोयाबीन वाण : 
१. पिडिकेव्ही अंबा (AMS 100-39), दिवस ९५ ते १०० ,उत्पादन  २५ ते ३०  किं. /हे.            
२. सुवर्ण सोया (AMS-MB-5-18),दिवस   ९६ ते १०२,उत्पादन २४ ते २८ किं. /हे.               
३. पिडिकेव्ही येलो गोल्ड (AMS 1001),दिवस ९५ ते १००,उत्पादन २२ ते २६ किं. /हे.          
४. पिडिकेव्ही पूर्वा (AMS 2014-1), दिवस १०२ ते १०५, उत्पादन २२ ते २६ किं. /हे.       
५. जे एस - ३३५,दिवस ९५ ते १०५, उत्पादन २८ ते ३० किं. /हे. धन्यवाद..! ","farmer asked about new non-sprouting soybean varieties ?",Varieties,NA,AGRICULTURE,MAHARASHTRA,3,6,2025
BARSHI,Oilseeds,2025-06-03T16:07:53.133,"Soybean (bhat)",SOLAPUR,4450187,"सुधारित जाती : लवकर येणारा वाण : परभणी सोना (MAUS-47), ग्रीन गोल्ड ३३४४, विक्रांत, जे एस ९५-६०                                                                               
मध्यम कालावधीत येणारा वाण :  फुले किमया (KDS-753),फुले दुर्वा (KDS-992), शक्ती (MAUS-81),जे एस ९३-०५ ,फुले कल्याणी (KDS-228) , समृद्धी (MAUS-71),जे एस - ३३५ 
अति उशिरा येणारा वाण : MAUS-१६२, फुले संगम (KDS-726),फुले अग्रणी (KDS-344), MACS-११८८                                                                                                                           ","FARMER ASKED ABOUT VARITIES OF SOYABEAN CROP ?",Varieties,NA,AGRICULTURE,MAHARASHTRA,3,6,2025
MANGALVEDHE,Others,2025-06-03T17:41:00.817,Others,SOLAPUR,4450553,"नमस्कार हवामान विभागाच्या अंदाजानुसार सोलापूर जिल्ह्यातील मंगळवेढा तालुक्यामध्ये पुढील पाचही दिवस वातावरण ढगाळ राहील हलक्या ते मध्यम स्वरूपाच्या पावसाची शक्यता आहे,  सरासरी कमाल तापमान - ३४  डिग्री सेल्सिअस किमान तापमान -२४डिग्री सेल्सिअस , वाऱ्याचा वेग १४ किलोमीटर प्रतितास , हवामान विभागाचा अंदाज घेऊन आपण आपल्या शेतीच्या मशागतीची कामे करावी तर धन्यवाद.. ","Farmer asked query on Weather","Cultural Practices",NA,AGRICULTURE,MAHARASHTRA,3,6,2025
BARSHI,Oilseeds,2025-06-03T17:46:54.623,"Soybean (bhat)",SOLAPUR,4450189,"सोयाबीन लागवड करताना जमीन बागायती असेल पाण्याची व्यवस्था असेल तर फुले संगम,फुले दूर्वा व जे एस ९३०५  या वानांची निवड करावी धन्यवाद","Farmer asked about varieties of soybean crop ?",Varieties,NA,AGRICULTURE,MAHARASHTRA,3,6,2025
MADHA,Pulses,2025-06-04T08:12:13.623,"Black Gram (urd bean)",SOLAPUR,4459506,"
हवामान विभागाच्या अंदाजानुसार  तालुक्यात,या आठवड्यामध्ये वातावरण अंशतः ढगाळ राहील,पावसाची शक्यता  आहे .आजचे तापमान  कमाल ३४  अंश सेल्सियस आणि किमान २४ अंश सेल्सियस ,वाऱ्याचा वेग -ताशी ४  किलोमीटर आहे. हवामान अंदाजानुसार पेरणी, खत व्यवस्थापन, पीक संरक्षण, सिंचन आदी बाबींचे नियोजन करावे धन्यवाद","Farmer asked query on Weather","Sowing Time and Weather",NA,AGRICULTURE,MAHARASHTRA,4,6,2025
MADHA,Pulses,2025-06-04T08:16:34.527,"Black Gram (urd bean)",SOLAPUR,4459504,"पेरणीचा कालावधी उडदाच्या
पिकांची पेरणी जूनच्या शेवटच्या ते जुलैच्या पहिल्या आठवड्यादरम्यान करावी पेरणीस उशीर झाल्यास उत्पादनात घट येते

","FARMER ASKED ABOUT SOWING TIME FOR BLACK GRAM CROP?","Sowing Time and Weather",NA,AGRICULTURE,MAHARASHTRA,4,6,2025
KARMALA,Others,2025-06-04T12:12:31.13,Others,SOLAPUR,4459723,"फार्मर आयडी बद्दल अधिक माहितीसाठी आपण जवळील कृषी कार्यालय किंवा जवळील सीएससी सेंटर महा-ई-सेवा केंद्र यांच्याशी संपर्क साधावा व अधिक माहितीसाठी पुढील दिलेल्या लिंक वर जाऊन माहिती मिळवू शकता (https://mhfr.agristack.gov.in/farmer-registry-mh/#/pages/home) , धन्यवाद .","FARMER ASKING ABOUT FARMER ID ? ","Government Schemes",NA,AGRICULTURE,MAHARASHTRA,4,6,2025
BARSHI,Others,2025-06-04T13:20:40.81,Others,SOLAPUR,4459994," पिक विमाच्या नुकसान भरपाई बद्दल अधिक माहितीसाठी आपण जवळी कृषी कार्यालयाची संपर्क साधावा अथवा पुढील दिलेल्या संपर्क क्रमांक सी संपर्क साधावा: 14447, धन्यवाद . ","FARMER ASKING ABOUT STATUS ON FINANCIAL ASSISTANCE OF CROP LOSS BY INSURANCE COMPANY WHICH IS CLAIM BY FARMER ? ","Crop Insurance",NA,AGRICULTURE,MAHARASHTRA,4,6,2025
KARMALA,Others,2025-06-04T13:51:22.957,Others,SOLAPUR,4459722,"चंदन कुमार, अवर सचिव, डिजिटल कृषी, कृषी आणि शेतकरी कल्याण विभाग, कक्ष क्रमांक ३९, कृषी भवन डॉ. राजेंद्र प्रसाद रोड, नवी दिल्ली ११०००१.

संपर्क: ०११-२३३८२९२६ / 02025712712","Farmer asked about Agristack toll free number? ","Government Schemes",NA,AGRICULTURE,MAHARASHTRA,4,6,2025
MADHA,Others,2025-06-04T14:55:21.087,Others,SOLAPUR,4459613,"हवामान विभागाच्या अंदाजानुसार आपला  सोलापूर  जिल्हा,  माढा तालुक्यात पुढील पाच दिवस वातावरण ढगाळ राहील .हलक्या ते मध्यम स्वरूपाचा पाऊस होऊ शकतो .सरासरी जास्तीत जास्त तापमान  ३५ अंश सेल्सिअस ,  कमीत कमी तापमान  २६ अंश सेल्सिअस ,वाऱ्याचा वेग  १४ किलोमीटर प्रति तास. 

धन्यवाद ...","Farmer asked query on Weather",Weather,NA,AGRICULTURE,MAHARASHTRA,4,6,2025
