BlockName,Category,CreatedOn,Crop,DistrictName,KCCCallID,KccAns,QueryText,QueryType,Season,Sector,StateName,day,month,year
SANGOLA,Others,2025-06-04T16:46:51.59,Others,SOLAPUR,4459747,"शेतकरी साहेब, प्रधान मंत्री फसल विमा योजना (PMFBY) संबंधित माहितीसाठी- तुम्ही कृषी रक्षक पोर्टल हेल्पलाइन (KRPH) 14447 वर कॉल करू शकता किंवा WhatsApp चॅटबॉट नंबर 7065514447 वर संदेश पाठवू शकता. संपर्क साधता न आल्यास आपल्या तालुक्याचे पिक विमा प्रतिनिधी- मो नंबर  : चेतन कटकाळे ९६६५६९८५६६,जिल्ह्याचे पिक विमा प्रतिनिधी मोबाईल नंबर-उमेश पळसे ७०८३६९७१७२ यांना संपर्क साधावा. योग्य माहिती न मिळाल्यास तक्रार तालुका कृषी अधिकारी यांच्याकडे करावी. धन्यवाद..!","FARMER ASKED ABOUT CROP LOSS & CROP INSURANCE RELATED INFORMATION & THEIR HELPLINE NUMBER ?","Government Schemes",NA,AGRICULTURE,MAHARASHTRA,4,6,2025
MANGALVEDHE,Others,2025-06-04T19:33:09.1,Others,SOLAPUR,4459924,"शेतकरी साहेब, पी.एम.किसान योजनेचे आपले स्टेटस चेक केल्यावर ई-केवायसी पूर्ण झालेली दाखवत नाही, महा-ई-सेवा केंद्रामध्ये जाऊन ई-केवायसी प्रकिया पूर्ण करून घ्यावी. होत नसल्यास तालुका कृषी अधिकाऱ्यांकडे तक्रार अर्ज सादर करावा. धन्यवाद..!","farmer asked query about pm kisan installment?","Government Schemes",NA,AGRICULTURE,MAHARASHTRA,4,6,2025
MOHOL,Oilseeds,2025-06-04T20:33:19.003,"Soybean (bhat)",SOLAPUR,4459910,"जिल्हा परिषदेच्या कृषी विभागाने शेतकऱ्यांच्या बियाणे, खते आदी तक्रारी दूर करण्यासाठी प्रत्येक कृषी केंद्रात जनजागृतीपर फलक लावणे बंधनकारक केले आहे. त्यात शेतकऱ्यांना व्हॉट्स अॅपवर तक्रारी करता याव्यात यासाठी ९३०७०७६१०७ हा क्रमांक जारी करण्यात आला आहे. जिल्ह्यात कापूस, खते यासंबंधी अनेकदा अडचणी असतात","FARMER ASKED ABOUT FERTILISER SHORTAGE IN HIS AREA ?","Fertilizer Use and Availability",NA,AGRICULTURE,MAHARASHTRA,4,6,2025
MOHOL,Others,2025-06-04T20:43:10.133,Others,SOLAPUR,4459908,"श्री अभिषेक अत्रे
८२०८४५२५८२
चौथा मजला, एस के टॉवर्स, नेल्सन स्क्वेअर जवळ, नागपूर ४४००१३
","FARMER ASKED ABOUT PM FBY ?","Government Schemes",NA,AGRICULTURE,MAHARASHTRA,4,6,2025
"SOLAPUR NORTH",Others,2025-06-04T20:53:35.087,Others,SOLAPUR,4460049,"शेतकरी साहेब महाबीज संपर्क क्रमांक -
फोन : (0724)-2455093, 2542060, टोल फ्री क्रमांक.1800-233-8877
ईमेल: hoadmin@mahabeej.com धन्यवाद. ","FARMER ASKED ABOUT CONTACT NUMBER OF MAHABEEJ ?","Government Schemes",NA,AGRICULTURE,MAHARASHTRA,4,6,2025
BARSHI,Oilseeds,2025-06-04T21:25:49.01,"Soybean (bhat)",SOLAPUR,4459675,"नमस्कार सर, हवामान विभागाच्या अंदाजानुसार आपल्या सोलापूर जिल्ह्यात, बार्शी तालुक्यात पुढील पाच दिवसात वातावरण ढगाळ असेल. हलक्या ते मध्यम पावसाची शक्यता दाखवलेली आहे. जास्तीत जास्त तापमान ३४ अंश सेल्सिअस ,कमीत कमी तापमान २९ अंश सेल्सिअस व वाऱ्याचा वेग ०७-११ किमी प्रति तास असेल. या हवामान विभागाच्या अंदाजानुसार आपल्या सोयाबीन पिकाचे नियोजन करावे. धन्यवाद.....!!!","Farmer asked query on Weather","Cultural Practices",NA,AGRICULTURE,MAHARASHTRA,4,6,2025
AKKALKOT,Oilseeds,2025-06-05T07:19:17.39,"Soybean (bhat)",SOLAPUR,4468264,"नमस्कार सर, हवामान विभागाच्या अंदाजानुसार आपल्या सोलापूर जिल्ह्यात,अक्कलकोट तालुक्यात पुढील पाच दिवस वातावरण ढगाळ असेल.हलक्या पावसाची शक्यता दाखवलेली आहे. जास्तीत जास्त तापमान ३६ अंश सेल्सिअस,कमीत कमी तापमान २५ अंश सेल्सिअस व वाऱ्याचा वेग ०२ किमी प्रति तास असेल.या हवामान विभागाच्या अंदाजानुसार आपल्या सोयाबीन पिकाच्या लागवडीचे नियोजन करावे.धन्यवाद!!!","Farmer asked query on Weather","Post Harvest Preservation",NA,AGRICULTURE,MAHARASHTRA,5,6,2025
AKKALKOT,Others,2025-06-05T09:43:23.7,Others,SOLAPUR,4468656,"प्रधानमंत्री किसान सम्मान निधी योजनेच्या अधिक माहितीसाठी संबंधित कृषी विभागाशी संपर्क साधावा .","FARMER ASKED ABOUT INFORMATION OF PM KISAN SAMMAN NIDHI YOJANA ?","Government Schemes",NA,AGRICULTURE,MAHARASHTRA,5,6,2025
AKKALKOT,Oilseeds,2025-06-05T09:46:15.613,"Soybean (bhat)",SOLAPUR,4468449,"महोदय,  हवामान विभागाच्या अंदाजानुसार सोलापूर जिल्हा अक्कलकोट तालुक्यात वातावरण ०५ जून ते ०९ जून २०२५ वातावरण ढगाळ असेल,  हलक्या पावसाची शक्यता आहे.  कमाल तापमान ३४ अंश सेल्सिअस,  किमान तापमान २४ अंश सेल्सिअस , वाऱ्याचा वेग सरासरी ०७ ते ११ किलोमीटर प्रतितास असेल. 
हवामान विभागाच्या अंदाजानुसार सोयाबीन पिकाची लागवड करावी. धन्यवाद.","Farmer asked query on Weather","Cultural Practices",NA,AGRICULTURE,MAHARASHTRA,5,6,2025
KARMALA,Others,2025-06-05T11:43:19.823,Others,SOLAPUR,4468399,"शेतकरी साहेब, फार्मर आयडी कार्ड विषयी अधिक माहितीसाठी- डिजिटल कृषी- कृषी आणि शेतकरी कल्याण विभाग, कृषी भवन, नवी दिल्ली संपर्क क्रमांक: 011-23382926, ईमेल: us-it@gov.in. या नंबरवर संपर्क साधून चौकशी करावी. वयक्तिक मार्गदर्शनासाठी- आपल्या क्षेत्राचे कृषी सहायक / ग्राम महसूल अधिकारी (तलाठी) याच्याशी संपर्क साधावा. धन्यवाद..!","FARMER ASKED INFORMATION ABOUT FARMER ID CARD AND THIEIR REGARDING CONTACT NUMBER ? 
","Government Schemes",NA,AGRICULTURE,MAHARASHTRA,5,6,2025
KARMALA,Fruits,2025-06-05T14:28:28.697,Banana,SOLAPUR,4468797,"केळी पिकात GOAL  गोल  ग्लायफोसेट (Glyphosate) आणि (ऑक्सीफ्लोरफेन 23.5% EC) (ह्या मधील एक तणनाशक घेऊ शकता)हे तणनाशक ८ मिली प्रति १० लिटर पाण्यामध्ये घेऊन फवारावे. धन्यवाद..! ","FARMER ASKED ABOUT WEED MANAGEMENT IN BANANA CROP ?","Cultural Practices",NA,HORTICULTURE,MAHARASHTRA,5,6,2025
MANGALVEDHE,Pulses,2025-06-05T15:02:03.957,"Pigeon pea (red gram/arhar/tur)",SOLAPUR,4468805,"हवामान विभागाच्या अंदाजानुसार सोलापूर  जिल्हा मंगळवेढा तालुका मध्ये वातावरण ढगाळ राहील व हलक्या ते मध्यम स्वरूपाचा पाऊस पडण्याची शक्यता आहे. किमान तापमान २४° से. आणि कमाल तापमान ३२° से. पर्यंत असेल. वाऱ्याचा वेग ताशी ७ ते १० कि.मी. दरम्यान राहण्याची शक्यता आहे. हवामान विभागाच्या अंदाजानुसार तूर पिकाची पेरणीचे नियोजन करू शकता धन्यवाद.","Farmer asked query on Weather","Cultural Practices",NA,AGRICULTURE,MAHARASHTRA,5,6,2025
BARSHI,Others,2025-06-05T15:40:34.36,Others,SOLAPUR,4468700,"नमस्कार सर पिक विमा संदर्भात आपण अधिक माहिती करिता पिक विमा कंपनी टोल फ्री क्रमांक- 14447 येथे संपर्क करावा किंवा कृषी सहाय्यक अधिकारी कार्यालय येथे भेट द्यावी धन्यवाद!","FARMER ASKED ABOUT CROP INSURANCE FOR SOYBEAN CROP FOR 2024 YEAR?","Government Schemes",NA,AGRICULTURE,MAHARASHTRA,5,6,2025
BARSHI,"Sugar and Starch Crops",2025-06-05T16:09:17.523,"Sugarcane (Noble Cane)",SOLAPUR,4468436,"हवामान विभागाच्या अंदाजानुसार आपल्या सोलापूर जिल्हा बार्शीतालुक्यात येत्या आठवड्यात ढगाळ वातावरण आणि पावसाची शक्यता आहे तापमान किमान 23 कमाल 34 अंश सेल्सिअस राहील .","Farmer asked query on Weather","Cultural Practices",NA,AGRICULTURE,MAHARASHTRA,5,6,2025
BARSHI,Pulses,2025-06-05T16:43:04.92,"Black Gram (urd bean)",SOLAPUR,4468514,"उडीद-

बियाण्याचे प्रमाण व बीजप्रक्रिया-

हेक्टरी १० ते १५ किलो बियाणे पुरेसे आहे पेरणीपूर्वी बियाण्यास प्रति किलो बाविस्टीन १ ग्रॅम किंवा थायरम २ ग्रॅम चोळावे. तसेच ट्रायकोडर्मा ४ ग्रॅम किलो बियाण्यास बीजप्रक्रिया केल्यास बुरशीजन्य रोगापासून पिकांचे नुकसान होत नाही. त्याचबरोबर १० किलो बियाण्यास जिवाणु संवर्धक रायझोबियम व पीएसबी प्रति २५० ग्रॅम लावून पेरणी करावी.

धन्यवाद.... 

","farmer asked about seed treatment for black gram?","	Plant Protection	",NA,AGRICULTURE,MAHARASHTRA,5,6,2025
KARMALA,Others,2025-06-05T17:53:26.35,Others,SOLAPUR,4468398,"फार्मर्स आयडी याबद्दल अधिक माहितीसाठी या टोल फ्री क्रमांक ०२०२५ ७१२७१२ वरती कॉल करून योग्य ती माहिती मिळवावी व जर माहिती नाही भेटली तर तुमच्या ग्राम महसूल अधिकारी महसूल किंवा कृषी सहाय्यक अधिकारी यांच्याशी संपर्क साधावा धन्यवाद...!","FARMER ASKED ABOUT FARMERS ID TOLL FREE NUMBER & FARMERS ID INFORMATION ?","Government Schemes",NA,AGRICULTURE,MAHARASHTRA,5,6,2025
BARSHI,Others,2025-06-06T10:09:17.777,Others,SOLAPUR,4476695,"हवामान अंदाजाच्या विभागानुसार बार्शी तालुक्यात वातावरण अंशता ढगाळ राहील पावसाची शक्यता कमी आहे तापमान जास्तीत जास्त 32ग्री सेल्सिअस कमीत कमी 24 डिग्री सेल्सिअस वाऱ्याचा  वेग 13 किमी प्रति ताशी राहील हवामान अंदाजानुसार मशागत करावी ","Farmer asked query on Weather","Cultural Practices",NA,AGRICULTURE,MAHARASHTRA,6,6,2025
AKKALKOT,Oilseeds,2025-06-06T11:17:39.343,"Soybean (bhat)",SOLAPUR,4476494," शेतकरी साहेब,सोलापूर जिल्हा अक्कलकोट तालुक्यातील हवामान अंदाज- ढगाळमय वातावरण राहील , पावसाची शक्यता नाही आहे . किमान तापमान २५ ° से. आणि कमाल तापमान ३४ ° से. पर्यंत असेल. वाऱ्याचा वेग ताशी १६ कि.मी. व आद्रता ६० ते ८०% दरम्यान राहण्याची शक्यता आहे. या अंदाजानुसार सोयाबीन  पिकाच्या पेरणी चे नियोजन करावे. धन्यवाद..!","Farmer asked query on Weather","Sowing Time and Weather",NA,AGRICULTURE,MAHARASHTRA,6,6,2025
MADHA,Others,2025-06-06T14:17:30.177,Others,SOLAPUR,4476901,"महोदय, भारतीय हवामान विभाग कृषी हवामानशास्त्र खात्याच्या अंदाजानुसार, सोलापूर जिल्हा माढा तालुका 6 जून ते 10 जून दरम्यान तुरळक ठिकाणी पाऊस पडण्याची शक्यता राहील, आजचे कमाल तापमान 32 अंश सेल्सिअस,आणि किमान तापमान 26 अंश सेल्सिअस राहण्याची शक्यता आहे .  वाऱ्याचा वेग सरासरी ताशी 7 किलोमीटर राहण्याची शक्यता आहे. ","Farmer asked query on Weather",Weather,NA,AGRICULTURE,MAHARASHTRA,6,6,2025
PANDHARPUR,Fruits,2025-06-06T17:14:29.32,Pomegranate,SOLAPUR,4477117,"शेतकरी साहेब, डाळिंब फळबाग बद्दल माहितीसाठी- राष्ट्रीय डाळिंब संशोधन केंद्र, सोलापूर. कार्यालयीन संपर्क क्रमांक : ०२१७-२३५४३३० / ०२१७-२३५०२६२ या नंबरवर संपर्क साधून आपल्या प्रश्नांची माहिती मिळवावी. धन्यवाद..! ","FARMER ASKED ABOUT HELPLINE NUMBER OF NATIONAL RESEARCH CENTRE ON POMEGRANATE, SOLAPUR ?","Training and Exposure Visits",NA,HORTICULTURE,MAHARASHTRA,6,6,2025
MOHOL,Others,2025-06-06T21:01:59.853,Others,SOLAPUR,4477040,"हवामान विभागाच्या अंदाजानुसार   सोलापूर जिल्यातील  मोहोळ तालुक्यात पुढील पाच दिवसाचे हवामान अंदाज : वातावरण ढगाळ राहील, आज पावसाची शक्यता नाही ,आजचे तापमान कमाल ३२ अंश सेल्सियस आणि किमान २७ अंश सेल्सियस, वाऱ्याचा वेग ताशी ७   किलोमीटर राहील व वातावरणातील आद्र्रता १५  टक्के दरम्यान राहील. हवामान अंदाजानुसार उडीद पिकाची पेरणी करून घ्यावी ","Farmer asked query on Weather",Weather,NA,AGRICULTURE,MAHARASHTRA,6,6,2025
BARSHI,"Sugar and Starch Crops",2025-06-07T06:39:09,"Sugarcane (Noble Cane)",SOLAPUR,4484931,"ऊस -तण नाशक - २ ,४ -डी (अमाईन सॉल्ट ५८ %) ४० मिली + सेन्कोर (मेट्रीब्युझीन ७० WP) ३० ग्रॅम  /१५ लिटर पाण्यातून फवारावे  
मोकळ्या शेतात तण नियंत्रणासाठी -मीरा ७१ १०० ग्रॅम + युरिया १०० ग्रॅम / १५ लिटर पाण्यामध्ये घेऊन फवारणी करावी","FARMER ASKED ABOUT WEED MANAGEMENT IN SUGARCANE FIELD AND IN FALLOW LAND? ","Weed Management",NA,AGRICULTURE,MAHARASHTRA,7,6,2025
MALSHIRAS,Others,2025-06-07T08:40:30.413,Others,SOLAPUR,4484636,"माळशिरस तालुका हवामान अंदाज आज पासून या आठवड्यामध्ये वातावरण ढगाळ आहे हलका ते मध्यम पाऊस पडण्याची शक्यता आहे आजचे तापमान जास्तीत जास्त ३५ °c कमीत कमी 24  अंश सेल्सिअस वाऱ्याचा वेग आहे ७ किलोमीटर प्रति तास","Farmer asked query on Weather",Weather,NA,AGRICULTURE,MAHARASHTRA,7,6,2025
MADHA,Others,2025-06-07T11:23:27.17,Others,SOLAPUR,4484182,"विभागाच्या अंदाजानुसार सोलापूर जिल्ह्यातील माढा तालुक्यामध्ये आज वातावरण ढगाळ आहे हलक्या स्वरूपाच्या पावसाची शक्यता आहे वाऱ्याचा वेग 11 किलोमीटर प्रतितास राहील तर तुम्ही तुमच्या मका पिकाला पाणी देण्याची व्यवस्था करा .","Farmer asked query on Weather",Weather,NA,AGRICULTURE,MAHARASHTRA,7,6,2025
BARSHI,Others,2025-06-07T11:41:07.69,Others,SOLAPUR,4484373,"नमस्कार सर, हवामान विभागाच्या अंदाजानुसार आपल्या  बार्शी  तालुक्यात पुढील पाच दिवस वातावरण ढगाळ असेल.हलक्या पावसाची शक्यता दाखवलेली आहे.जास्तीत जास्त तापमान ३६   अंश सेल्सिअस,कमीत कमी तापमान २६    अंश सेल्सिअस व वाऱ्याचा वेग ७      किमी प्रति तास असेल.या हवामान विभागाच्या अंदाजानुसार आपल्या   पिकाचे  नियोजन करावे.धन्यवाद!!! 
","Farmer asked query on Weather",Weather,NA,AGRICULTURE,MAHARASHTRA,7,6,2025
MANGALVEDHE,Fruits,2025-06-07T12:20:22.26,Pomegranate,SOLAPUR,4484427," डाळिंबाचा मृग बहर धरताना रोगग्रस्त भागामध्ये मृग बहार घेणे टाळावे. वर्षातून फक्त 1 बहार घ्यावा. बागेला 3 ते 4 महिने विश्रांती द्यावी. नवीन बाग असल्यास दोन वर्षांनंतरच पहिला बहार धरावा. झाडांना ताण देण्यासाठी हलक्‍या जमिनीत 30-35 दिवस तर मध्यम ते भारी जमिनीत 40-45 दिवस पाणी बंद करावे.
झाडांची पानगळ : डाळिंबाचा मृग बहर धरताना छाटणीपूर्वी झाडाची पानगळ होणे महत्त्वाची आहे. त्यासाठी डाळिंब बागेच्या छाटणीच्या तीन आठवडे अगोदर 30 मिलि इथ्रेल प्रति 10 लि. पाण्यात घेऊन पानगळ करावी. पूर्ण पानगळ झाल्यानंतरच छाटणी झाली की, मृग बहर परफेक्ट होतो. ","FARMER ASKED ABOUT POMOGRANATE BAHAR MANAGEMENT ? ","Cultural Practices",NA,HORTICULTURE,MAHARASHTRA,7,6,2025
PANDHARPUR,Fruits,2025-06-07T12:54:59.55,Guava,SOLAPUR,4484952,"शेतकरी साहेब, नमस्कार शेतकरी साहेब ,पेरू पिकाच्या अधिकच्या माहिती करिता आपण महात्मा फुले कृषि विद्यापीठ,राहुरी, जि.अहमदनगर-दूरध्वनी नंबर: ०२४२६ २४३२१५ या नंबरवर संपर्क साधून माहिती मिळवावी. धन्यवाद..!","FARMER ASKED ABOUT CONTACT NUMBER OF MAHATMA PHULE KRISHI VIDYAPEETH, RAHURI ?","Government Schemes",NA,HORTICULTURE,MAHARASHTRA,7,6,2025
MADHA,Others,2025-06-07T12:57:26.9,Others,SOLAPUR,4484707,"शेतकरी साहेब,सोलापूर  जिल्हा म्हाडा   तालुक्यातील दि. ७ ते ११ जून दरम्यानचे हवामान अंदाज - ढगाळमय वातावरणासह रिमझिम - हलका पाऊस असेल. किमान तापमान २४° से. आणि कमाल तापमान ३८° से. पर्यंत असेल. वाऱ्याचा वेग ताशी ७ ते १० कि.मी. व आद्रता ७० ते ८०% दरम्यान राहण्याची शक्यता आहे. या अंदाजानुसार पीक पेरणीचे नियोजन करावे. धन्यवाद..!","Farmer asked query on Weather","Sowing Time and Weather",NA,AGRICULTURE,MAHARASHTRA,7,6,2025
MADHA,Pulses,2025-06-07T14:30:41.633,"Pigeon pea (red gram/arhar/tur)",SOLAPUR,4484398,"तुर पिकासाठी 10 26 26 50 किलो आणि सिंगल सुपर फॉस्फेट 50 किलो प्रति एकरी द्यावे धन्यवाद","Askingabout fertilizer for tur crop ?","Fertilizer Use and Availability",NA,AGRICULTURE,MAHARASHTRA,7,6,2025
