BlockName,Category,CreatedOn,Crop,DistrictName,KCCCallID,KccAns,QueryText,QueryType,Season,Sector,StateName,day,month,year
JAMNER,Others,2024-09-14T14:15:59.52,Others,JALGAON,2460517,"शेतकरी साहेब, प्रधानमंत्री किसान सन्मान निधी योजनेचे स्टेटस चेक केल्यावर ई-केवायसी पूर्ण झालेली दाखवत नाही, महा-ई-सेवा केंद्रामध्ये जाऊन ई-केवायसी प्रकिया पूर्ण करून घ्यावी. धन्यवाद..!
नमस्कार सर आपण जमिनीचे खरेदी डिसेंबर 2021 मध्ये केलेली आहे त्यामुळे आपल्याला पी एम किसान योजनेचा लाभ भेटू शकत नाही धन्यवाद","FARMER ASKED ABOUT STATUS OF INSTALLMENT IN PRADHANMANTRI KISAN SANMAN NIDHI YOJANA ? ","Government Schemes",NA,AGRICULTURE,MAHARASHTRA,14,9,2024
CHALISGAON,"Fiber Crops",2024-09-15T08:41:11.647,"Cotton (Kapas)",JALGAON,2468557,"हवामान विभागाच्या अंदाजानुसार ,आपल्या चाळीसगाव       तालुक्यात पुढील 5 दिवसांत  वातावरण ढगाळ राहील .हलक्या स्वरूपाच्या पावसाची शक्यता आहे आजचे तापमान - कमाल ३१ अंश सेल्सियस आणि किमान२०   अंश सेल्सियस  ,आद्रता ८४ % ,वाऱ्याचा वेग - तासी१३  किलोमीटर आहे. हवामान विभागाच्या अंदाजानुसार पेरणी आपण  पिकाचे , पिकास पाणी ,खत व्यवस्थापन , तण व्यवस्थापन याचे योग्य नियोजन करावे. धन्यवाद! ","Farmer asked query on Weather","Fertilizer Use and Availability",NA,AGRICULTURE,MAHARASHTRA,15,9,2024
JALGAON,Oilseeds,2024-09-15T09:39:02.58,"Soybean (bhat)",JALGAON,2468677,"हवामान विभागाच्या अंदाजानुसार जळगाव जिल्हा जळगाव तालुक्यात या आठवड्यामध्ये वातावरण अंशतः ढगाळ राहील, हलक्या पावसाची शक्यता आहे .आजचे तापमान  कमाल -३१ अंश सेल्सियस आणि किमान -२४ अंश सेल्सियस ,वाऱ्याचा वेग -ताशी १४ किलोमीटर आहे.हवामान अंदाजानुसार ,ऊस पिकात पाण्याचे नियोजन करावे धन्यवाद.","Farmer asked query on Weather","Cultural Practices",NA,AGRICULTURE,MAHARASHTRA,15,9,2024
CHOPDA,Fruits,2024-09-15T10:36:27.673,Papaya,JALGAON,2468363,"शेतकरी साहेब, पपई पिकावरील पिवळा मोझॅक रोग हा पांढरी माशी, मावा किडीच्या पादुर्भावामुळे पसरतो याच्या नियंत्रणासाठी- Actra अॅक्टरा (थायोमिथॉक्सम २५%) हे कीटकनाशक ५ ते ८ ग्रॅम प्रति १५ लिटर पाण्यामध्ये घेऊन फवारणी करावी.+ SAAF साफ (कार्बेन्डाझिम १२% + मॅन्कोझेब ६३%) हे बुरशीनाशक ३० ग्रॅम प्रति १५ लिटर पाण्यामध्ये घेऊन फवारणी करावी. धन्यवाद..! 

","FARMER ASKED ABOUT SPRAY FOR CONTROL OF YELLOW VAIN MOISAC VIRUS IN PAPAYA CROP ?
","	Plant Protection	",NA,HORTICULTURE,MAHARASHTRA,15,9,2024
CHOPDA,Fruits,2024-09-15T10:43:58.66,Papaya,JALGAON,2468362,"शेतकरी साहेब आपल्या पपई पिकातील गोगलगायी नियंत्रणासाठी आपण स्नेल कील (मेटलडीहाइड 2.5% पेलेट)15 ते 20 किलो प्रति एकर द्यावे धन्यवाद","FARMER ASKED ABOUT SNAIL ATTACK ON PAPAYA PLANT LEAVES?","	Plant Protection	",NA,HORTICULTURE,MAHARASHTRA,15,9,2024
RAVER,Others,2024-09-15T13:47:23.697,Others,JALGAON,2468785,"शेतकरी साहेब, प्रधानमंत्री किसान सन्मान निधी योजनेचे स्टेटस चेक केल्यावर ई-केवायसी पूर्ण झालेली दाखवत नाही, महा-ई-सेवा केंद्रामध्ये जाऊन ई-केवायसी प्रकिया पूर्ण करून घ्यावी. धन्यवाद..!
","FARMER ASKED ABOUT STATUS OF INSTALLMENT IN PRADHANMANTRI KISAN SANMAN NIDHI YOJANA ? 
","Government Schemes",NA,AGRICULTURE,MAHARASHTRA,15,9,2024
AMALNER,Others,2024-09-15T14:41:41.563,Others,JALGAON,2468566,"पुणे बाजार समिती आवळा पिकाचे बाजारभाव पुढीलप्रमाणे 15/09/2024
कमीत कमी दर प्रति क्विंटल   =2500
जास्तीत जास्त दर प्रति क्विंटल   =3000
सरासरी दर प्रति क्विंटल     =2700","FARMER ASKED ABOUT MARKET RATE OF AONLA CROP?","Market Information",NA,AGRICULTURE,MAHARASHTRA,15,9,2024
MUKTAINAGAR,"Fiber Crops",2024-09-15T15:49:49.33,"Cotton (Kapas)",JALGAON,2468301,"आपल्या कापूस पिकामध्ये पात्याचे कैऱ्यामध्ये रुपांतर होण्यासाठी सिनर्जी कंपनीचे बोरा टेक mo  किंवा डीएपी २ % (१ लिटर पाण्यात २० ग्राम डीएपी) याची फवारणी घ्यावी. फुल गळ नियंत्रण - प्लानोफिक्स (NAA) - 3 मिली/15लिटर पाण्यामध्ये घेऊन फवारणी करावी. किंवा 
लिक्विड फॉर्म मध्ये कॅल्शियम आणि बोरॉन यांची एकत्रित फवारणी घेऊ शकता ज्याच्यामुळे फुलगळ होणार नाही किंवा बोंडगळ होणार नाही आणि याच्यामुळे परागीकरण चांगलं होऊन आपल्या फुलांचा व पातांचा योग्य रूपांतर बोंडामध्ये करेल प्रमाण 15 लिटरच्या पंपासाठी 25 एम एल. ","FARMER ASKED ABOUT PROBLEM OF BALL SETTING AND FLOWER DROP IN COTTON?","	Plant Protection	",NA,AGRICULTURE,MAHARASHTRA,15,9,2024
CHOPDA,Vegetables,2024-09-16T10:07:14.053,Onion,JALGAON,2476479,"कांदा पिकाच्या वाढीसाठी - १९ १९ १९ हे विद्राव्य खत ८० ग्राम + सुक्ष्म अन्नद्रव्य २५ मिली किंवा झिंक सल्फेट २५ ग्राम हे प्रति १५ लिटर पाण्यामध्ये घेऊन फवारावे. धन्यवाद..!
","FARMER ASKED ABOUT SPRAY FOR CONTROL YELLOWING ONION  CROP DURING EARLY STAGE OF GROWTH ?
","Nutrient Management",NA,HORTICULTURE,MAHARASHTRA,16,9,2024
JALGAON,Fruits,2024-09-16T10:39:47.057,Mango,JALGAON,2476266,"आंबा या पिकास आपण 191919 हे खत देऊ शकता. धन्यवाद...!","Farmers asked if they can give 19:19:19 fertilizer to mango crop ?","Fertilizer Use and Availability",NA,HORTICULTURE,MAHARASHTRA,16,9,2024
BHADGAON,"Fiber Crops",2024-09-16T10:44:48.183,"Cotton (Kapas)",JALGAON,2476486,"--कापूस -लाल्या -मॅग्नीशियम सल्फेट 60 ग्रॅम +12:61:00 75 ग्रॅम/15 लिटर पाण्यात फवारणी करावी,धन्यवाद
","FARMER ASKED ABOUT LEAVES ARE  REDDNING OF COTTON CROP DUE TO MAGNESIUM SULPHATE DEFICINCY  ?
","	Plant Protection	",NA,AGRICULTURE,MAHARASHTRA,16,9,2024
AMALNER,Vegetables,2024-09-16T10:46:16.14,Onion,JALGAON,2476407,"प्रोफेक्स सुपर ३० मिलि /१५ लिटर पाण्यात घेवून फवारणी करावी.(प्रोफेनोफॉस ४०% + सायपरमेथ्रीन ४%) नागार्जुन
","FARMER ASKED ABOUT ATTACK OF LEAF EATING CATERPILLAR ? 
","	Plant Protection	",NA,HORTICULTURE,MAHARASHTRA,16,9,2024
JALGAON,"Fiber Crops",2024-09-16T12:11:51.64,"Cotton (Kapas)",JALGAON,2476289,"महोदय हवामान खात्याच्या अंदाजानुसार तुमच्या जळगाव जिल्हा जळगाव  तालुका मध्ये  १७/०९/२०२४ ते २१ /०९ /२०२४ या पाच दिवसा दरम्यान हलक्या स्वरूपाचा पाऊस पडण्याची शक्यता आहे . ढगाळ वातावरण असेल , कमाल तापमान ३१ अंश सेल्सिअस आणि किमान तापमान २१  अंश सेल्सिअस राहण्याची शक्यता आहे आणि वाऱ्याचा वेग ताशी १६  किलोमीटर राहण्याची शक्यता आहे. हा हवामान अंदाज घेऊन आपण आपल्या कापूस पिकामध्ये योग्य त्यावेळी पाणी, निंदणी , खतव्यवस्थापन , कीटकनाशक फवारणी / डवरणी नियोजन  करू शकता. धन्यवाद...!","Farmer asked query on Weather",Weather,NA,AGRICULTURE,MAHARASHTRA,16,9,2024
BODWAD,Others,2024-09-16T15:15:48.17,Others,JALGAON,2476538,"पिक विमा संदर्भात माहितीसाठी पिक विमा कंपनीशी संपर्क साधा. धन्यवाद !","FARMER ASKED ABOUT PMFBY ?","Government Schemes",NA,AGRICULTURE,MAHARASHTRA,16,9,2024
ERANDOL,"Fiber Crops",2024-09-16T18:24:59.227,"Cotton (Kapas)",JALGAON,2475965,"कपाशी पिकाला PROKLEM आठ ग्रॅम अधिक झिरो बावन चौतीस 100 ग्राम प्रति पंधरा लिटर पाण्यामध्ये घेऊन फवारणी करावी.","FARMER AKSING ABOUT LEPIDOPTERIAN PEST ATTACK ON COTTON?","	Plant Protection	",NA,AGRICULTURE,MAHARASHTRA,16,9,2024
ERANDOL,Others,2024-09-16T18:26:16.383,"Cotton (Kapas)",JALGAON,2475966,"या आठवड्यामध्ये वातावरण  ढगाळ राहील,पावसाची शक्यता  नाही.आजचे तापमान  कमाल 32 अंश सेल्सियस आणि किमान 28 अंश सेल्सियस ,वाऱ्याचा वेग -ताशी 13 किलोमीटर आहे.हवामान अंदाजानुसार पेरणी, खत व्यवस्थापन, पीक संरक्षण, सिंचन आदी बाबींचे नियोजन करावे धन्यवाद ! 
","Farmer asked query on Weather",Weather,NA,AGRICULTURE,MAHARASHTRA,16,9,2024
JAMNER,"Fiber Crops",2024-09-17T08:39:55.267,"Cotton (Kapas)",JALGAON,2484120,"महोदय, हवामान  खात्याच्या अंदाजानुसार  वातावरण ढगाळ राहील.जामनेर तालुका  आणि   हवामान अंदाज - येत्या आठवड्यात वातावरण ढगाळ राहील,हलक्या  पावसाची शक्यता आहे, तापमान - किमान - २३ ℃ आणि कमाल-३३ ℃ , वाऱ्याचा वेग ताशी -१४ किलोमीटर/ ताशी, हवामान अंदाजानुसार कापूस पिकामध्ये  कीटक नाशक फवारणी  आदी बाबींचे नियोजन करावे. 
","Farmer asked query on Weather","	Water Management	",NA,AGRICULTURE,MAHARASHTRA,17,9,2024
MUKTAINAGAR,"Fiber Crops",2024-09-17T12:35:38.74,"Cotton (Kapas)",JALGAON,2484306,"13..00.45 70 ग्रॅम + ह्युमिक ऍसिड 30मिली  15 लिटर पाण्यामध्ये घेऊन फवारणी करावी. धन्यवाद!
","FARMER ASKED ABOUT YELOWING ON COTTON  ?
","Fertilizer Use and Availability",NA,AGRICULTURE,MAHARASHTRA,17,9,2024
JAMNER,"Fiber Crops",2024-09-17T15:44:36.063,"Cotton (Kapas)",JALGAON,2484374,"कापूस पिकातील रस शोषक किडी (मावा तुडतुडे पांढरी माशी) अलिका 8 मिली / १५ लिटर पाण्यामध्ये घेऊन फवारणी करावी. (थायोमेथाक्झाम 12.6 %+ लाम्बडा सायलोथ्रीन 9.5%) ","FARMER ASKED ABOUT ATTACK OF SUCKING PEST (APHIDS,JASSIDS,WHITE FLY)ON COTTON ? ","	Plant Protection	",NA,AGRICULTURE,MAHARASHTRA,17,9,2024
DHARANGAON,"Fiber Crops",2024-09-17T18:12:14.677,"Cotton (Kapas)",JALGAON,2484110,"कापूस पिकावरील पांढरी माशी आणि तुडतुडे नियंत्रण -लान्सर गोल्ड  ३० ग्रॅम + एम ४५ - ३० ग्राम /१५ लिटर पाण्यातून फवारणी करा (असिफेट ५० + इमिडाक्लोप्रिड १.८ एस पी) युपीएल ","Attack of Jassids/Leaf hoppers in cotton  ? ","	Plant Protection	",NA,AGRICULTURE,MAHARASHTRA,17,9,2024
PAROLA,Others,2024-09-17T18:38:21.923,Others,JALGAON,2484333,"
शेतकरी साहेब, प्रधानमंत्री किसान सन्मान निधी योजना विषयी अधिक माहितीसाठी : आपल्या तहसील कार्यालयामध्ये नोडल अधिकारी (कृषी अधिकारी) यांच्याशी संपर्क साधावा , प्रधानमंत्री किसान सन्मान निधी योजनेचे स्टेटस चेक केल्यावर ई-केवायसी पूर्ण झालेली दाखवत नाही, महा-ई-सेवा केंद्रामध्ये जाऊन ई-केवायसी प्रकिया पूर्ण करून घ्यावी. धन्यवाद..!
","FARMER ASKED ABOUT STATUS OF INSTALLMENT IN PRADHANMANTRI KISAN SANMAN NIDHI YOJANA ? 
","Government Schemes",NA,AGRICULTURE,MAHARASHTRA,17,9,2024
CHOPDA,Others,2024-09-18T11:52:35.053,Others,JALGAON,2492553,"--प्रधानमंत्री किसान सन्मान निधी योजनेबद्दल  अधिक माहितीसाठी टोल फ्री क्रमांक 155261/1800115526  किंवा नोडल अधिकारी यांच्याशी संपर्क साधा
","FARMER ASKED ABOUT PRADHANMANTRI KISAN SANMAN NIDHI YOJANA HELPLINE  NUMBER","Government Schemes",NA,AGRICULTURE,MAHARASHTRA,18,9,2024
PAROLA,Others,2024-09-18T12:11:36.34,Others,JALGAON,2492391,"जर आपण मागच्या वर्षीची इपिक पाहणी केली असेल तर आपल्याला मागच्या वर्षीच्या सोयाबीन आणि कपाशी पिकासाठीचे अनुदान मिळून जाते परंतु जर आपण ही पिक पाहणी केली असेल तर ते अनुदान आपल्याला मिळणार नाही तरी आता यावर्षीची इपिक पाहणी करून घ्यावी त्यानंतर तुम्हाला त्याचे पैसे मिळून जातात धन्यवाद","farmer asked about soyabean and cotton anudan ?","Government Schemes",NA,AGRICULTURE,MAHARASHTRA,18,9,2024
JAMNER,Millets,2024-09-18T12:57:24.927,"Maize (Makka)",JALGAON,2492355,"हवामान विभागाच्या अंदाजानुसार जळगाव जिल्ह्यातील जामनेर तालुक्यात या आठवड्यात वातावरण ढगाळ राहील पावसाची शक्यता आहे कमाल तापमान 32 डिग्री सेल्सिअस किमान तापमान २२ डिग्री सेल्सिअस वाऱ्याचा वेग 15 किलोमीटर ताशी सरासरी आद्रता ८५% हवामान विभागाच्या अंदाजानुसार मका पिकासाठी नियोजन करा धन्यवाद","Farmer asked query on Weather","Cultural Practices",NA,AGRICULTURE,MAHARASHTRA,18,9,2024
BHADGAON,Others,2024-09-18T14:06:52,Others,JALGAON,2492579,"प्रधानमंत्री किसान सन्मान निधी योजना विषयी अधिक माहितीसाठी : आपल्या तहसील कार्यालयामध्ये नोडल अधिकारी (कृषी अधिकारी) यांच्याशी संपर्क साधावा किंवा पीएम-किसान हेल्पलाइन क्रमांक : 155261 / 011-24300606 या नंबर वरती संपर्क करावा. धन्यवाद..!
","FARMER ASKED ABOUT STATUS OF INSTALLMENT IN PRADHANMANTRI KISAN SANMAN NIDHI YOJANA ? 
","Government Schemes",NA,AGRICULTURE,MAHARASHTRA,18,9,2024
BHADGAON,Millets,2024-09-18T15:13:36.45,"Maize (Makka)",JALGAON,2492426," सोयाबीन पिकाचे बाजार भाव अमरावती बाजार समिती  18/09/2024
कमीत कमी  4450 रुपये प्रति क्विंटल,
जास्तीत जास्त  4550 रुपये प्रति क्विंटल,
सरासरी   4500 रुपये  प्रति क्विंटल,
धन्यवाद..!  
","farmer asked about market information of maize crop from amravati market ?
","Market Information",NA,AGRICULTURE,MAHARASHTRA,18,9,2024
BHADGAON,Millets,2024-09-18T15:15:41.7,"Maize (Makka)",JALGAON,2492428,"मका  पिकाचे बाजार भाव अमरावती बाजार समिती  18/09/2024
कमीत कमी  2100 रुपये प्रति क्विंटल,
जास्तीत जास्त  2050 रुपये प्रति क्विंटल,
सरासरी   2000 रुपये  प्रति क्विंटल,
धन्यवाद..!  
","farmer asked about market information of maize crop from amravati market ?
","Market Information",NA,AGRICULTURE,MAHARASHTRA,18,9,2024
PACHORA,Others,2024-09-18T15:56:11.26,Others,JALGAON,2492492,"प्रधानमंत्री किसान सन्मान निधी योजनेबद्दल अधिक माहितीसाठी नोडल अधिकारी किंवा कृषी खात्याशी संपर्क करावा ","FARMER ASKED ABOUT INSTALLMENT ISSUE PRADHANMANTRI KISAN SAMMAN NIDHI YOJNA?","Government Schemes",NA,AGRICULTURE,MAHARASHTRA,18,9,2024
MUKTAINAGAR,Others,2024-09-18T18:25:58.89,Others,JALGAON,2492764,"--सी एस सी सेंटरला  ला भेट द्या 
","asked about crop insurance","Crop Insurance",NA,AGRICULTURE,MAHARASHTRA,18,9,2024
JAMNER,Millets,2024-09-18T19:39:45.22,"Maize (Makka)",JALGAON,2492545,"हवामान विभागाच्या अंदाजानुसार जळगाव जिल्ह्यातील जामनेर तालुक्यातील हवामान अंदाज- वातावरण अंशतः / ढगाळमय तर आज पावसाची शक्यता रिमझिम ते हलक्या स्वरूपाची असेल. आजचे तापमान कमाल 32 तर किमान 22 अंश सेल्सियस, वाऱ्याचा वेग 15 कि.मी.ताशी राहील. या अंदाजानुसार मका पिकाच्या काढणीचे नियोजन करावे. धन्यवाद!","Farmer asked query on Weather","Cultural Practices",NA,AGRICULTURE,MAHARASHTRA,18,9,2024
JAMNER,Others,2024-09-19T09:19:55.16,Others,JALGAON,2500580,"  महोदय, हवामान विभागाच्या अंदाजानुसर जळगाव  जिल्हा,जामनेर  तालुक्यात, या आठवड्यामध्ये वातावरण अंशतः ढगाळ राहील. येत्या आठवड्यात हलक्या स्वरूपाच्या पावसाची शक्यता आहे. तापमान - कमाल ३१  अंश सेल्सियस आणि किमान २३  अंश सेल्सियस राहण्याची शक्यता आहे, वाऱ्याचा वेग - ताशी १७ किलोमीटर राहील . ","Farmer asked query on Weather",Weather,NA,AGRICULTURE,MAHARASHTRA,19,9,2024
CHALISGAON,"Fiber Crops",2024-09-19T10:04:50.213,"Cotton (Kapas)",JALGAON,2500216,"महोदय, हवामान खात्याच्या अंदाजानुसार, तुमच्या जळगाव जिल्हा चाळीसगाव तालुका या आठवड्यात हलक्या रिमझिम पावसासह पाऊस पडण्याची शक्यता आहे, अंशतः ढगाळ वातावरण असेल. आजचे किमान तापमान २४  अंश सेल्सिअस आणि कमाल तापमान ३१  अंश सेल्सिअस राहण्याची शक्यता आहे आणि वाऱ्याचा वेग ताशी १२  किलोमीटर राहण्याची शक्यता आहे. हंगामानुसार, कीटकनाशकांची फवारणी, तणनाशकांची फवारणी, सूक्ष्म अन्नद्रव्यांची फवारणी करावी. धन्यवाद...! शुभ दिवस .
","Farmer asked query on Weather","	Plant Protection	",NA,AGRICULTURE,MAHARASHTRA,19,9,2024
JAMNER,"Fiber Crops",2024-09-19T10:52:11.447,"Cotton (Kapas)",JALGAON,2500567,"कापूस लाल्या रोग नियंत्रण करण्यासाठी चिलेटेड मॅग्नेशियम १ ग्राम + १२:६१:०० ५ ग्राम + बायर कॉन्फिडोर १० मिली प्रति लिटर पाण्यामध्ये मिसळून फवारणी करावी. 

","Farmer asking about how to control reddning in cotton crop?","Nutrient Management",NA,AGRICULTURE,MAHARASHTRA,19,9,2024
PAROLA,Others,2024-09-19T13:05:12.623,Others,JALGAON,2500099,"तुम्ही राज्याद्वारे अपात्र म्हणून चिन्हांकित केल्यामुळे तुम्हाला अपडेट करण्याची परवानगी नाही. कृपया KYS (तुमची स्थिती जाणून घ्या) मॉड्यूलमध्ये तुमची स्थिती तपासा","FARMER ASKED ABOUT STATUS OF INSTALLMENT IN PRADHANMANTRI KISAN SANMAN NIDHI YOJANA?","Government Schemes",NA,AGRICULTURE,MAHARASHTRA,19,9,2024
