BlockName,Category,CreatedOn,Crop,DistrictName,KCCCallID,KccAns,QueryText,QueryType,Season,Sector,StateName,day,month,year
SHIRALA,Oilseeds,2024-09-23T14:59:57.19,"Soybean (bhat)",SANGLI,2538501,"हवामान विभागाच्या अंदाजानुसार सांगली जिल्हा शिराळा तालुक्यात, या आठवड्यामध्ये वातावरण अंशतः ढगाळ राहील, हलक्या -मध्यम स्वरूपाचे पावसाची शक्यता  आहे. आजचे तापमान  कमाल - 29 अंश सेल्सियस आणि किमान - 24 अंश सेल्सियस ,वाऱ्याचा वेग -ताशी 7 किलोमीटर आहे. हवामान विभागाच्या अंदाजानुसार सोयाबीन पिकातील काढणी नियोजन करावे, धन्यवाद ","Farmer asked query on Weather","Cultural Practices",NA,AGRICULTURE,MAHARASHTRA,23,9,2024
VALVA-ISLAMPUR,"Sugar and Starch Crops",2024-09-23T16:46:13.713,"Sugarcane (Noble Cane)",SANGLI,2539675,"ऊस -तण नाशक - २ , ४ -डी (अमाईन सॉल्ट ५८ %) ४० मिली + सेन्कोर (मेट्रीब्युझीन ७० % WP) ३० ग्रॅम /१५ लिटर पाण्यातून फवारावे 
","FARMER ASKED ABOUT WEED MANAGEMENT IN SUGARCANE?","Weed Management",NA,AGRICULTURE,MAHARASHTRA,23,9,2024
ATPADI,Fruits,2024-09-24T10:17:43.613,Pomegranate,SANGLI,2546216,"डाळिंब या पिकामध्ये इथरेल सोबत दुसरे कुठलेही औषध मिक्स करू नये .धन्यवाद शुभ दिवस","farmer asked about ethrel spraying?","Nutrient Management",NA,HORTICULTURE,MAHARASHTRA,24,9,2024
JATH,Fruits,2024-09-24T17:17:14.217,Pomegranate,SANGLI,2550364,"डाळिंब पिकावरील मर रोग नियंत्रण - कब्रिओटॉप - ३० ग्रॅम/१५ लिटर पाण्यामध्ये घेऊन फवारणी करावी (पायराक्लॉस्ट्रोबीन ५०% + मेटीराम ५५%). ","FARMER ASKED ABOUT ATTACK OF WILT ON POMEGRANATE?","	Plant Protection	",NA,HORTICULTURE,MAHARASHTRA,24,9,2024
TASGAON,Others,2024-09-25T12:33:55.96,Others,SANGLI,2561191,"महाराष्ट्रातील सांगली येथे ढगाळ वातावरणासह सध्याचे हवामान 27 अंश सेल्सिअस आहे. पावसाची शक्यता 24 टक्के, आर्द्रता 79 टक्के आणि वाऱ्याचा वेग ताशी 12 किमी आहे.","Farmer asked query on Weather",Weather,NA,AGRICULTURE,MAHARASHTRA,25,9,2024
KHANAPUR-VITA,Others,2024-09-25T13:18:31.203,Others,SANGLI,2561210,"मोकळ्या शेतात तण नियंत्रणासाठी -ग्लायफोसेट अमोनियम सॉल्ट  71% एसजी- १०० ग्रॅम + युरिया १०० ग्रॅम / १५ लिटर पाण्यामध्ये घेऊन फवारणी करावी (मीरा ७१ )","Asked about weed management ?
","Government Schemes",NA,AGRICULTURE,MAHARASHTRA,25,9,2024
JATH,Others,2024-09-25T14:00:22.197,Others,SANGLI,2561195,"महाराष्ट्रातील सांगली येथे ढगाळ वातावरणासह सध्याचे हवामान 26 अंश सेल्सिअस आहे. पावसाची शक्यता 20 टक्के, आर्द्रता 78 टक्के आणि वाऱ्याचा वेग ताशी 19 किमी आहे.","Farmer asked query on Weather",Weather,NA,AGRICULTURE,MAHARASHTRA,25,9,2024
KADEGAON,Others,2024-09-25T15:57:16.003,Others,SANGLI,2561613," नमस्कार सर प्रधानमंत्री किसान सन्मान निधी योजनेच्या  अधिक माहितीसाठी तहसील कार्यालयातील  नोडल अधिकारी यांना भेट द्या किंवा अधिक माहितीसाठी हेल्पलाइन क्रमांक ०११-२४३००६०६, १५५२६१ येथे संपर्क करावा  धन्यवाद...
","FARMER ASKED ABOUT STATUS OF INSTALLMENT IN PRADHANMANTRI KISAN SANMAN NIDHI YOJANA AND HELPLINE NUMBER ?","Government Schemes",NA,AGRICULTURE,MAHARASHTRA,25,9,2024
KADEGAON,Others,2024-09-25T15:57:19.597,Others,SANGLI,2561614," नमस्कार सर प्रधानमंत्री किसान सन्मान निधी योजनेच्या  अधिक माहितीसाठी तहसील कार्यालयातील  नोडल अधिकारी यांना भेट द्या किंवा अधिक माहितीसाठी हेल्पलाइन क्रमांक ०११-२४३००६०६, १५५२६१ येथे संपर्क करावा  धन्यवाद...
","FARMER ASKED ABOUT STATUS OF INSTALLMENT IN PRADHANMANTRI KISAN SANMAN NIDHI YOJANA AND HELPLINE NUMBER ?","Government Schemes",NA,AGRICULTURE,MAHARASHTRA,25,9,2024
JATH,Fruits,2024-09-25T20:07:47.173,Pomegranate,SANGLI,2561401,"डाळिंब पिकामध्ये करप्याच्या नियंत्रणासाठी कब्रिओटॉप 30 ग्रॅम/१५ लिटर पाण्यामध्ये घेऊन फवारणी करावी (पायराक्लॉस्ट्रोबीन ५०% + मेटीराम ५५%) बीएएसएफ  
","farmer ask about control of blight disease on pomegranate?","	Plant Protection	",NA,HORTICULTURE,MAHARASHTRA,25,9,2024
VALVA-ISLAMPUR,Oilseeds,2024-09-26T09:43:52.133,"Soybean (bhat)",SANGLI,2569975,"महोदय, हवामान विभागाच्या अंदाजानुसार आपल्या सांगली जिल्हा, वाळवा तालुक्यात, येत्या आठवड्यात ढगाळ वातावरण राहील आणि हलका ते मध्यम पावसाची शक्यता आहे. आजचे कमाल तापमान २७ अंश सेल्सियस आणि किमान तापमान २२ अंश सेल्सियस राहण्याची शक्यता आहे. वाऱ्याचा वेग १८ किलोमीटर प्रति तास राहण्याची शक्यता आहे, हवामान अंदाजानुसार आपण आपल्या सोयाबीन पिकाच्या काढणीचे नियोजन करावे. धन्यवाद...!!!","Farmer asked query on Weather","Cultural Practices",NA,AGRICULTURE,MAHARASHTRA,26,9,2024
KADEGAON,Others,2024-09-26T10:43:49.37,Others,SANGLI,2569818,"आपल्या प्रधानमंत्री किसान सन्मान निधी योजनेच्या खात्याचा मोबाईल क्रमांक अपडेट करून घ्यावा. धन्यवाद ..!","FARMER ASKED ABOUT PRADHANMANTRI KISAN SANMAN NIDHI YOJANA ACCOUNT STATUS ?","Government Schemes",NA,AGRICULTURE,MAHARASHTRA,26,9,2024
KHANAPUR-VITA,Others,2024-09-26T11:38:49.8,Others,SANGLI,2569856,"प्रधानमंत्री किसान सन्माननिधी योजनेसाठी आपले सरकार सेवा केंद्र ( CSC ) मधून ई - केवायसी करून घ्यावी .","Farmer asked information about Prime Minister Kisan Samman Yojana?
","Government Schemes",NA,AGRICULTURE,MAHARASHTRA,26,9,2024
JATH,Fruits,2024-09-26T11:51:27.02,Pomegranate,SANGLI,2569825,"सीबी प्लस ३० मिली  +१५ लिटर पाण्यात घेऊन फवारणी करणे.
","Farmer asked Flower Drop Pomegranate  ?","Fertilizer Use and Availability",NA,HORTICULTURE,MAHARASHTRA,26,9,2024
KHANAPUR-VITA,Others,2024-09-26T14:27:21.05,Others,SANGLI,2574809,"अळिंबी प्रकल्प कृषी महाविद्यालय पुणे -०२० २५५३७०३३ /०३८ 
","FARMER ASKED ABOUT MUSHROOM CUTIVATION ?","Cultural Practices",NA,AGRICULTURE,MAHARASHTRA,26,9,2024
JATH,Others,2024-09-26T17:36:27.59,Others,SANGLI,2574855,"प्रधानमंत्री किसान सन्मान योजनेचे आपले आधार बँक अकाउंट सीडींग  झालेले नाही तरी आपण आपल्या  बँक मध्ये जाऊन आपले आधार बँक अकाउंट सीडींग करून घ्यावे धन्यवाद . ","FARMER ASKED ABOUT STATUS OF INSTALLMENT IN PRADHANMANTRI KISAN SANMAN NIDHI YOJANA? 
","Government Schemes",NA,AGRICULTURE,MAHARASHTRA,26,9,2024
VALVA-ISLAMPUR,Others,2024-09-26T18:00:20.29,Others,SANGLI,2574736,"पी एम किसान सन्मान निधी योजनेचे स्टेटस चेक करत असताना आपले लँड सीडींग केवायसी आधार बँक अकाउंट सीडिंग एस दाखवत आहे आणि आपण नुकताच बँक अकाउंट केलेला असल्यामुळे पुढच्या वेळी आपल्याला हप्ता मिळू शकेल धन्यवाद ","FARMER ASKED A QUESTION ABOUT PM KISAN SAMMAN NIDHI YOJANA?","Government Schemes",NA,AGRICULTURE,MAHARASHTRA,26,9,2024
JATH,Pulses,2024-09-27T09:20:15.313,"Pigeon pea (red gram/arhar/tur)",SANGLI,2581122,"तूर फुलोऱ्यात असल्यास मायक्रोला 30 मिली +12:61:00 - 60 ग्रॉम / १५ लिटर पाण्यात  घेऊन फवारणी करणे.
","FARMER ASKED ABOUT SPRAYING AT FLOWERING STAGE ON PIGEAON PEA ?
","Fertilizer Use and Availability",NA,AGRICULTURE,MAHARASHTRA,27,9,2024
MIRAJ,"Sugar and Starch Crops",2024-09-27T11:14:01.69,"Sugarcane (Noble Cane)",SANGLI,2580802,"ऊस पिकावरील फुटव्यासाठी - १२ ६१ ०० ६० ग्रॅम + मायक्रोला ३० मिली + बाविस्टीन ३० ग्राम / १५ लिटर पाण्यात घेऊन फवारणी करणे 
","farmer asked about fertilizers spray for sugarcane crop ?","Fertilizer Use and Availability",NA,AGRICULTURE,MAHARASHTRA,27,9,2024
MIRAJ,Others,2024-09-27T12:58:43.13,Others,SANGLI,2580973,"शेतकरी साहेब, पी.एम.किसान योजनेची माहिती तपासण्याकरिता नोंदणी क्रमांक व रजिस्टर मोबाईल नंबर किंवा नंबर वरती आलेला ओटीपी सांगणे आवश्यक आहे. धन्यवाद..! ","FARMER ASKED ABOUT STATUS OF INSTALLMENT IN PRADHANMANTRI KISAN SANMAN NIDHI YOJANA ? ","Government Schemes",NA,AGRICULTURE,MAHARASHTRA,27,9,2024
VALVA-ISLAMPUR,Oilseeds,2024-09-28T09:05:19.723,"Soybean (bhat)",SANGLI,2592264,"हवामान विभागाच्या अंदाजानुसार आपल्या  वल्वा-इस्लामपुर तालुक्यात - या आठवड्यामध्ये वातावरण अंशतः ढगाळ राहील. हलक्या ते मध्यम पावसाची शक्यता आहे .आजचे तापमान -कमाल - 28 अंश सेल्सियस आणि किमान - 21 अंश सेल्सियस  ,वाऱ्याचा वेग -तासी  11  किलोमीटर आहे.हवामान विभागाच्या अंदाजानुसार सोयाबीन पीक काढणीचे नियोजन करावे धन्यवाद","Farmer asked query on Weather","Cultural Practices",NA,AGRICULTURE,MAHARASHTRA,28,9,2024
MIRAJ,Others,2024-09-28T09:24:51.683,Others,SANGLI,2592262,"एरंडी सुधारित जाती गिरीजा,व्हीआय -९,अरूणा, सौभाग्य, डीसीएस(ज्योती) -९ 
","ASKED ABOUT VARIETIES OF CASTOR ?",Varieties,NA,AGRICULTURE,MAHARASHTRA,28,9,2024
MIRAJ,Others,2024-09-28T14:13:03.917,Others,SANGLI,2598181,"प्रधानमंत्री किसान सन्मान निधी योजनेचे स्टेटस ओटीपी न सांगितल्यामुळे चेक होऊ शकत नाही धन्यवाद!","FARMER ASKED ABOUT STATUS OF INSTALLMENT IN PRADHANMANTRI KISAN SANMAN NIDHI YOJANA?     ","Government Schemes",NA,AGRICULTURE,MAHARASHTRA,28,9,2024
VALVA-ISLAMPUR,Cereals,2024-09-28T14:27:29.32,"Paddy (Dhan)",SANGLI,2597881,"आपल्या भात पिकावरील करपा आणि तांबेरा रोगाच्या नियंत्रणासाठी कॉपर ऑक्‍सिक्‍लोराईड 25 ग्रॅम किंवा स्ट्रेप्टोमायसीन 0.5 ग्रॅम प्रति 10 लिटर पाण्यात मिसळून 10 दिवसांच्या अंतराने फवारणी करावी. 
आपल्या भात पिकातील ओंबीमध्ये दाणे चांगले भरण्यासाठी ००:५२:३४ - ७० ग्रॅम प्रति पंधरा लिटर पंप याप्रमाणे फवारणी करावी.  धन्यवाद!","FARMER ASKED ABOUT ATTACK OF RUST AND BLIGHT IN PADDY?","	Plant Protection	",NA,AGRICULTURE,MAHARASHTRA,28,9,2024
JATH,Others,2024-09-28T14:40:03.093,Others,SANGLI,2598106,"तालुका  हवामान अंदाज - येत्या आठवड्यात वातावरण ढगाळ राहील, हलक्या ते मध्यम पावसाची शक्यता आहे, तापमान - किमान - 25 ℃ आणि कमाल- 34 ℃ , वाऱ्याचा वेग ताशी - 12 किलोमीटर/ ताशी, हवामान अंदाजानुसार पिकांना पाणी देणे, पेरणी, खत मात्रा, पीक संरक्षण, तण व्यवस्थापन, पिकांची कापणी आदी बाबींचे नियोजन करावे. धन्यवाद 
","Farmer asked query on Weather",Weather,NA,AGRICULTURE,MAHARASHTRA,28,9,2024
MIRAJ,Others,2024-09-28T19:30:43.177,Others,SANGLI,2598283,"आपल्या कमी क्षेत्रासाठी पालेभाज्या पिकाची लागवड योग्य राहील धन्यवाद .","Farmer asked about cultivation in small land ?","Sowing Time and Weather",NA,AGRICULTURE,MAHARASHTRA,28,9,2024
MIRAJ,"Sugar and Starch Crops",2024-09-29T10:11:55.627,"Sugarcane (Noble Cane)",SANGLI,2604611,"-१९:१९:१९- 75 ग्रॅम +सुक्ष्म अन्नद्रव्ये 30 मिली /१५ लिटर पाण्यात घेवून आळवणी करावी.
क्लोरोपायरीफोस - 40 मिलि  /१५ लिटर पाण्यात घेवून आळवणी करावी.","Farmer asked about Fertilizer spray for growth in sugarcane crop?  ","Fertilizer Use and Availability",NA,AGRICULTURE,MAHARASHTRA,29,9,2024
MIRAJ,Others,2024-09-29T13:08:48.027,Others,SANGLI,2604370,"हवामान विभागाच्या अंदाजानुसार, मिरज तालुक्यात पुढील ५ दिवसांत  वातावरण ढगाळ राहील. हलक्या स्वरूपाच्या पावसाची शक्यता आहे. आजचे तापमान कमाल ३३ अंश सेल्सियस आणि किमान २३ अंश सेल्सियस, वाऱ्याचा वेग तासी ११ किलोमीटर राहण्याची शक्यता आहे. ","Farmer asked query on Weather",Weather,NA,AGRICULTURE,MAHARASHTRA,29,9,2024
MIRAJ,Others,2024-09-30T10:54:56.12,Others,SANGLI,2616292,"प्रधानमंत्री किसान सन्मान योजना ची वेबसाईट चालत नसल्यास पुन्हा प्रयत्न करून आपली फेरफार सातबारा आणि आधार कार्ड वगैरे अपडेट करा धन्यवाद !","Farmer asked information about Pradhan Mantri Kisan Mandhan Yojna? (PM-KMY) 
","Government Schemes",NA,AGRICULTURE,MAHARASHTRA,30,9,2024
MIRAJ,Others,2024-09-30T13:03:54.387,Others,SANGLI,2616291,"
प्रधानमंत्री किसान सम्मान निधी योजनेच्या अधिक माहितीसाठी संबंधित कृषी विभागाशी संपर्क साधावा .","FARMER ASKED ABOUT INFORMATION OF PM KISAN SAMMAN NIDHI YOJANA ?","Government Schemes",NA,AGRICULTURE,MAHARASHTRA,30,9,2024
MIRAJ,Others,2024-09-30T17:02:06.51,Others,SANGLI,2616290,"प्रधानमंत्री शेतकरी सन्मान निधी योजने अंतर्गत अधिक माहितीसाठी तहसीलदार कार्यालयामध्ये नोडल अधिकारी यांची भेट घ्यावी धन्यवाद.","FARMER ASKED INFORMATION ABOUT PM KISAN SCHEME ?","Government Schemes",NA,AGRICULTURE,MAHARASHTRA,30,9,2024
MIRAJ,Oilseeds,2024-09-30T21:36:51.993,"Soybean (bhat)",SANGLI,2622554,"महोदय, हवामान खात्याच्या अंदाजानुसार  सांगली  जिल्ह्यातील मिरज तालुक्यामध्ये या आठवड्यात हलक्या रिमझिम पावसासह मध्यम पाऊस पडण्याची शक्यता आहे, अंशतः ढगाळ वातावरण असेल. आजचे किमान तापमान ३०  अंश सेल्सिअस आणि कमाल तापमान २३  अंश सेल्सिअस राहण्याची शक्यता आहे आणि वाऱ्याचा वेग ताशी १३  किलोमीटर राहण्याची शक्यता आहे. हंगामानुसार सोयाबीन  पिकाची काढणी  पिकामध्ये पाणीव्यवस्थापन करू शकता कीटकनाशकांची फवारणी, तणनाशकांची फवारणी, सूक्ष्म अन्नद्रव्यांची फवारणी करू शकता . धन्यवाद...!   . शुभ दिवस .","Farmer asked query on Weather","	Plant Protection	",NA,AGRICULTURE,MAHARASHTRA,30,9,2024
PACHORA,Pulses,2024-09-13T15:15:35.117,"Pigeon pea (red gram/arhar/tur)",JALGAON,2452122,"तुर पिकातील पिवळेपणा कमी करण्यासाठी साफ ३० ग्रॅम+मायक्रोला ३० मिली /१५ लिटर पाण्यामध्ये घेऊन फवारणी करावी (कार्बेन्डाझिम १२% + मॅन्कोझेब ६३%) युपीएल धन्यवाद
","FARMER ASKED A QUESTION ABOUT YELLOWING IN TUR CROP?
","	Plant Protection	",NA,AGRICULTURE,MAHARASHTRA,13,9,2024
BHADGAON,"Fiber Crops",2024-09-13T15:25:03.91,"Cotton (Kapas)",JALGAON,2452392,"--सर आपल्या कापूस पिकाला फुले पाते न लागले त्याची जी फसवणूक झाली आहे त्याबद्दल आपण कंप्लेंट करण्यासाठी त्यांच्या कंपनी  कस्टमर केअर नंबर वरती कॉल करून विचारू शकतो धन्यवाद","The farmer asked if he wanted to complain to the company about the cotton crop not blooming ?",Seeds,NA,AGRICULTURE,MAHARASHTRA,13,9,2024
AMALNER,Others,2024-09-13T16:21:18.403,Others,JALGAON,2452404,"इमामेक्टिन बेंजोनेट आणि मायक्रोला हे एकत्र फवारणी केली तरी चालते त्या संदर्भात कोणती अडचण येत नाही धन्यवाद","Farmer asked about the mix with proclaim and microlla to spraying for crop?","	Plant Protection	",NA,AGRICULTURE,MAHARASHTRA,13,9,2024
JAMNER,Others,2024-09-14T08:48:58.9,Others,JALGAON,2460792,"--नमस्कार सर प्रधानमंत्री किसान सन्मान निधी योजनेचे स्टेटस चेक करण्यासाठी आपला आधार नंबर मिळवून शकला नाही आपण पूर्ण कॉल करू शकता,धन्यवाद ","FARMER ASKED ABOUT STATUS OF INSTALLMENT IN PRADHANMANTRI KISAN SANMAN NIDHI YOJANA?
","Government Schemes",NA,AGRICULTURE,MAHARASHTRA,14,9,2024
MUKTAINAGAR,Others,2024-09-14T09:24:57.113,Others,JALGAON,2460803,"-- नमस्कार सर प्रधानमंत्री किसान सन्मान निधी योजनेच्या  अधिक माहितीसाठी तहसील कार्यालयातील  नोडल अधिकारी यांना भेट द्या किंवा अधिक माहितीसाठी हेल्पलाइन क्रमांक ०११-२४३००६०६, १५५२६१ येथे संपर्क करावा  धन्यवाद...
",") FARMER ASKED ABOUT STATUS OF INSTALLMENT IN PRADHANMANTRI KISAN SANMAN NIDHI YOJANA AND HELPLINE NUMBER ?
","Government Schemes",NA,AGRICULTURE,MAHARASHTRA,14,9,2024
PACHORA,Millets,2024-09-14T10:21:21.813,"Pearl Millet (Bajra/Bulrush Millet/Spiked Millet)",JALGAON,2460563,"बाजरी पिकाची पेरणीची वेळ संपलेली असून आपण सध्या बाजरी पिकाची पेरणी करू शकत नाही धन्यवाद","Farmer asked about drilling the bajara crop current season?","Sowing Time and Weather",NA,AGRICULTURE,MAHARASHTRA,14,9,2024
YAWAL,Pulses,2024-09-14T12:46:54.46,"Bengal Gram (Gram/Chick Pea/Kabuli/Chana)",JALGAON,2460325,"नमस्कार सर  लागवड:-15 ऑक्टोंबर ते 15 नोव्हेंबर दरम्यान पेरणी 
लागवड पेरून किंवा टोकून करू शकतात
 दोन ओळी मधील अंतर 30 सेमी व दोन झाडांमधील अंतर 10 सेमी
 बियाणे 2 सेमी पेक्षा जास्त खोलीवर जाऊ देऊ नये एकरी 30 ते 40 किलो बियाणे वापरावे धन्यवाद ! 

","FARMER ASKED ABOUT SOWING TIME OF GRAM  CROP RELATED INFORMATION ?
","Sowing Time and Weather",NA,AGRICULTURE,MAHARASHTRA,14,9,2024
JAMNER,Others,2024-09-14T14:01:01.14,Others,JALGAON,2460875,"PM-KISAN पोर्टलवर शेतकऱ्यांची आधीच नोंदणी झाली आहे. कृपया लाभार्थी स्थिती अंतर्गत शेतकरी कॉर्नरमधून तुमची स्थिती तपासा. धन्यवाद...!","farmer asked about pradhanmantri kisan sanman nidhi yojana account status ?","Government Schemes",NA,AGRICULTURE,MAHARASHTRA,14,9,2024
