BlockName,Category,CreatedOn,Crop,DistrictName,KCCCallID,KccAns,QueryText,QueryType,Season,Sector,StateName,day,month,year
SARSOL,Others,2022-10-25T08:45:43.953,Others,"KANPUR CITY",3131552,"श्रीमान जी किसान सम्मान निधि संशोधन के लिए जिला उप कृषि निदेशक से संपर्क करें
","provide about information of bank account correction in Kisan Samman Nidhi ?

","Government Schemes",NA,AGRICULTURE,"UTTAR PRADESH",25,10,2022
HARGAON,Others,2022-10-25T08:48:34.18,Others,SITAPUR,3131543,"श्रीमान जी प्रधानमंत्री किसान सम्मान निधि योजना में आपकी 11वीं किस्त 17 अक्टूबर को भेजी जा चुकी है |","Information about Prime Minister Kisan Samman Nidhi Yojana Status..? ","Government Schemes",NA,AGRICULTURE,"UTTAR PRADESH",25,10,2022
"RAM PUR",Others,2022-10-25T08:51:31.477,Others,JAUNPUR,3131597,"श्रीमान जी पीएम किसान सम्मान निधि के बारे में जानने के लिए आप अपने रजिस्ट्रेशन नंबर अथवा रजिस्टर्ड मोबाइल नंबर उपलब्ध कराएं जिससे आपको जानकारी दी जा सके 18001801488 या राजकीय बीज भंडार या उप कृषि निदेशक कार्यालय पर संपर्क करें","Information about pm kisan samman nidhi yojana ..?","Government Schemes",NA,AGRICULTURE,"UTTAR PRADESH",25,10,2022
BHUTA,Others,2022-10-25T09:02:15.207,Others,BAREILLY,3131547,"श्रीमान जी प्रधानमंत्री किसान सम्मान निधि योजना संबंधित शिकायत निवारण के लिए हेल्पलाइन 1800-180-1488 नंबर पर संपर्क करें","Information about problem of not getting the benefit of Kisan Samman Nidhi Scheme","Government Schemes",NA,AGRICULTURE,"UTTAR PRADESH",25,10,2022
AMROHA,"Plantation Crops",2022-10-23T16:38:35.69,"Oil palm","JYOTIBA PHULE NAGAR",3120129,"सर आप Imidacloprid 17.8%SL 10ml प्रति एकड़ 15 लीटर पानी में घोलकर स्प्रे करें |","Information about pest control in Palm tree..?","	Plant Protection	",NA,HORTICULTURE,"UTTAR PRADESH",23,10,2022
"RAMPUR SANRAMGARH",Cereals,2022-10-23T16:38:46.52,"Paddy (Dhan)",PRATAPGARH,3120143,"Cartap Hydrochloride  4% जीआर 8-10 किलोग्राम/एकड़ धन के खेत में दलवये और सिंचाई करे","tell me information about pest management in rice crop ?","	Plant Protection	",NA,AGRICULTURE,"UTTAR PRADESH",23,10,2022
FIROZABAD,Others,2022-10-23T16:39:03.38,Others,FIROZABAD,3120159," श्रीमान जी आप प्रधानमंत्री किसान सम्मान निधि योजना के अंतर्गत किसी भी प्रकार का संशोधन एवं जानकारी हेतु - विकासखण्ड के राजकीय कृषि बीज भण्डार के गोदाम प्रभारी अथवा जनपद के उप कृषि निदेशक से सम्पर्क करे  | "," Information about Pradhan Mantri Kisan Samman Nidhi Yojana ?  

  

 ","Government Schemes",NA,AGRICULTURE,"UTTAR PRADESH",23,10,2022
MIRGANJ,Others,2022-10-23T16:41:20.193,Others,BAREILLY,3120186," श्रीमान जी कृषि निदेशालय लखनऊ के नंबर पर 1800180 1488 कॉल करके आप अधिक जानकारी ले सकते हैं","Tell me about the Pradhan Mantri Kisan Samman Nidhi Yojana ?","Government Schemes",NA,AGRICULTURE,"UTTAR PRADESH",23,10,2022
GOHAND,Vegetables,2022-10-23T16:43:08.287,"Peas (field peas/ garden peas/matar)",HAMIRPUR,3119878,"श्रीमान जी खादें (किलोग्राम प्रति एकड़)

   UREA  SSP  MOP
  30        150         30
प्रति एकड़ प्रयोग करें","information about pea nutrient management","Fertilizer Use and Availability",NA,HORTICULTURE,"UTTAR PRADESH",23,10,2022
KARWI,Others,2022-10-23T16:43:54.273,Others,CHITRAKOOT,3120123,"श्रीमान जी आपके यहां पूरे सप्ताह मौसम बिल्कुल साफ रहेगा बारिश की संभावना नहीं है मौसम को देखते हुए कृषि कार्य करें|","Farmer asked query on Weather",Weather,NA,AGRICULTURE,"UTTAR PRADESH",23,10,2022
Amethi,Others,2022-10-23T16:47:52.44,Others,"AMETHI ( Shahu Ji Maharaj)",3120218,"श्रीमान जी पीएम किसान सम्मान निधि की जानकारी तकनीकी समस्या के कारण देने में असमर्थ हैं अतः आप 18001801488 संपर्क करें या राजकीय बीज भंडार या उप कृषि निदेशक कार्यालय पर संपर्क करें","Information about PM Kisan Samman Nidhi..?","Government Schemes",NA,AGRICULTURE,"UTTAR PRADESH",23,10,2022
HOLAGARH,Oilseeds,2022-10-23T16:48:47.693,Mustard,ALLAHABAD,3120151," महोदय जी-23 अक्टूबर से 28 अक्टूबर तक मौसम साफ रहने की संभावना है ,अधिकतम तापमान 30 डिग्री सेल्सियस न्यूनतम तापमान 15 डिग्री सेल्सियस रहने की संभावना है, हवा की गति 4 से 11 किलोमीटर प्रति घंटा की रफ्तार से चलने की संभावना है, मौसम के पूर्वानुमान के अनुसार कार्य करें |
","Farmer asked query on Weather",Weather,NA,AGRICULTURE,"UTTAR PRADESH",23,10,2022
"MOHAMMADABAD GOHANA",Fruits,2022-10-23T16:52:12.257,Papaya,MAU,3120198,"श्रीमान जी पपीते की प्रजातियां Honey Dew,Pusa Delicious,Pusa Majesty,Coorg Honey Dew,Pusa Dwarf,Pusa Giant,Pusa Giant हैं","Provide information about varieties of Papaya? 
","Cultural Practices",NA,HORTICULTURE,"UTTAR PRADESH",23,10,2022
USAWAN,Others,2022-10-23T16:56:30.5,Others,BADAUN,3120125,"श्रीमान जी PM-Kisan Helpline No: 011-24300606,155261 पर कॉल करके जानकारी प्राप्त कर सकते हैं |
","Information about Prime Minister Kisan Samman Nidhi Yojana Toll Free Number......?
","Government Schemes",NA,AGRICULTURE,"UTTAR PRADESH",23,10,2022
"RAMIA BEHAR",Others,2022-10-23T16:58:12.07,Others,KHERI,3120175,"श्रीमान जी पीएम- किसान सम्मान निधि योजना संबंधित अधिक जानकारी हेतु अपने ब्लॉक पर या फिर जिले के उप कृषि निदेशक जी कार्यालय से संपर्क करें| संबंधित अधिक जानकारी हेतु हेल्पलाइन नंबर पर संपर्क करें- 011-24300606/155261/1800 11 5526.  (नई-दिल्ली) ","Information about PM- Kisan Samman Nidhi Yojana (PM- KSNY)......?","Government Schemes",NA,AGRICULTURE,"UTTAR PRADESH",23,10,2022
"THANA BHAWAN",Others,2022-10-23T17:16:42.993,Others,"SHAMLI (PRABUDH NAGER)",3120167,"श्रीमान जी पीएम किसान सम्मान निधि की वेबसाइट में कुछ तकनीकी समस्या के कारण मैं आपका स्टेटस चेक करने में असमर्थ हूं आप कुछ समय बाद जानकारी ले सकते हैं या Pm.kisan.gov.in की वेबसाइट पर जाकर के स्वयं चेक कर सकते हैं अधिक जानकारी के लिए PM-Kisan Helpline No. 155261 / 011-24300606, 18001801488
","Information about beneficiary status of pm kisan samman nidhi scheme...?
","Government Schemes",NA,AGRICULTURE,"UTTAR PRADESH",23,10,2022
BARKHERA,Others,2022-10-23T17:28:58.487,Others,PILIBHIT,3120156,"श्रीमान जी प्रधानमंत्री किसान सम्मान निधि योजना से संबंधित अधिक जानकारी के लिए आप अपने यहां के राजकीय बीज गोदाम प्रभारी या
जिला कृषि उपनिदेशक कार्यालय पर संपर्क करें या विभाग के नंबर पर संपर्क - 011 – 23381092, 011-24300606 करके जानकारी प्राप्त
करें","Tell me about the Pradhan Mantri Kisan Samman Nidhi Yojana ?","Government Schemes",NA,AGRICULTURE,"UTTAR PRADESH",23,10,2022
TARABGANJ,Others,2022-10-23T17:29:11.993,Others,GONDA,3120237," श्रीमान जी प्रधानमंत्री सम्मान निधि योजना की जानकारी के लिए आप अपने जिले में बीज गोदाम प्रभारी या कृषि उपनिदेशक कार्यालय में जाकर संपर्क कर  सकते हैं help line number  155261 / 011-24300606  ,18001801488","Information About Pradhan Mantri Samman Nidhi scheme? ","Government Schemes",NA,AGRICULTURE,"UTTAR PRADESH",23,10,2022
SALARPUR,Cereals,2022-10-23T17:29:15.27,Wheat,BADAUN,3120166,"महोदय जी गेहूं की प्रजातियां पी.बी.डब्लू.-343, यू.पी.-2338, के.-9006, के.-9107, के.-307, एच. डी.-2687,यू.पी.-2382, पी.डी.डब्लू-233, पी.डी.डब्लू.-215, डब्लू.एच.-896, एच.आई.-8381, पी.बी.डब्लू.-502 हैं","information about wheat crop variety ?",Varieties,NA,AGRICULTURE,"UTTAR PRADESH",23,10,2022
TODARPUR,Others,2022-10-23T17:33:41.97,Others,HARDOI,3120238,"श्रीमान जी किसान सम्मान निधि योजना के अंतर्गत जानकारी लेने के लिए 1800 – 180 – 1488 ,155 261 या 1800-11-5526 , 011-24300606 , 011- 23381092 से संपर्क करें","Pls tell me beneficiary status under the Pradhan Mantri Kisan Samman Nidhi Yojana.","Government Schemes",NA,AGRICULTURE,"UTTAR PRADESH",23,10,2022
UMARDA,Cereals,2022-10-23T17:34:12.327,"Paddy (Dhan)",KANNAUJ,3120239,"महोदय धान की बालियां पकने के बाद खंडवा की समस्या है तो उसकी कटाई करा लें","Information about false smut problem in paddy ..?","	Plant Protection	",NA,AGRICULTURE,"UTTAR PRADESH",23,10,2022
"BANI KODAR",Others,2022-10-23T17:52:16.37,Others,BARABANKI,3120893,"श्रीमान जी प्रधानमंत्री किसान सम्मान निधि योजना से संबंधित अधिक जानकारी के लिए आप अपने यहां के विकासखण्ड पर बीज भण्डार प्रभारी जी अथवा जनपद के उप कृषि निदेशक जी से सम्पर्क करे | 
","Information about Prime Minister Kisan Samman Nidhi Yojana Status....?     
","Government Schemes",NA,AGRICULTURE,"UTTAR PRADESH",23,10,2022
BIKAPUR,Oilseeds,2022-10-23T17:59:26.4,Mustard,FAIZABAD,3118678,"pendimethalin ","farmer asked about mustard crops weedicide ","Weed Management",NA,AGRICULTURE,"UTTAR PRADESH",23,10,2022
RAMNAGAR,Cereals,2022-10-23T18:02:47.577,"Paddy (Dhan)",BASTI,3120876,"महोदय प्रधानमंत्री  किसान  सम्मान निधि योजना का वेबसाइट www.pmkisan.gov.in में फार्मर कॉर्नर  पर स्टेटस ऑफ़ सेल्फ रजिस्टर्ड /CSC फार्मर में आधार कार्ड नम्बर भर कर स्टेटस  देख सकते है|
","Information About Pradhan mantri kisan samman nidhi yojna Website…?
","Government Schemes",NA,AGRICULTURE,"UTTAR PRADESH",23,10,2022
"BANI KODAR",Others,2022-10-23T18:07:10.933,Others,BARABANKI,3120896,"श्रीमान जी प्रधानमंत्री किसान सम्मान निधि योजना की वेबसाइट सुचारू रूप से न चल पाने के कारण स्टेटस की जानकारी नहीं प्राप्त हो पा रही है आप कुछ समय पश्चात कॉल करके देख सकते हैं  यदि वेबसाइट चलेगी तो जानकारी मिल जाएगी |","Information about beneficiary status of Pm Kisan Samman Nidhi Yojana..? 
","Government Schemes",NA,AGRICULTURE,"UTTAR PRADESH",23,10,2022
BEHJAM,Others,2022-10-23T18:08:41.367,Others,KHERI,3120903,"श्रीमान जी प्रधानमंत्री किसान सम्मान निधि योजना से संबंधित अधिक जानकारी के लिए आप अपने यहां के विकासखण्ड पर बीज भण्डार प्रभारी जी अथवा जनपद के उप कृषि निदेशक जी से सम्पर्क करे | 
","Information about Prime Minister Kisan Samman Nidhi Yojana Status....?     
","Government Schemes",NA,AGRICULTURE,"UTTAR PRADESH",23,10,2022
TAKHA,Cereals,2022-10-23T18:16:37.167,"Paddy (Dhan)",ETAWAH,3120831,"श्रीमान जी 23 अक्टूबर से 28 अक्टूबर तक आपके क्षेत्र में मौसम साफ रहने की संभावना है किसी भी प्रकार की बूंदाबांदी या बारिश होने की कोई संभावना नहीं है आज का न्यूनतम तापमान 18°C और अधिकतम तापमान 22 °C है और हवा की गति 4 से 11 किलोमीटर प्रति घंटा रहने की संभावना है मौसम के अनुसार कृषि कार्य करें |
","Farmer asked query on Weather",Weather,NA,AGRICULTURE,"UTTAR PRADESH",23,10,2022
UMARDA,Oilseeds,2022-10-23T18:20:47.86,Mustard,KANNAUJ,3120389,"श्रीमान जी 23 से 28 अक्टूबर तक आपके यहां मौसम पूरी तरह साफ रहेगा ना कोई वर्षा है ना कोई बादल आपके यहां अधिकतम तापमान 26 डिग्री सेंटीग्रेड न्यूनतम 18 डिग्री सेंटीग्रेड हवा की गति 3 किलोमीटर प्रति घंटा रहने की संभावना है हवा की दिशा उत्तरी से उत्तरी पूर्वी रहने की संभावना है अतः कृषि कार्य मौसम के अनुसार करें","Farmer asked query on Weather",Weather,NA,AGRICULTURE,"UTTAR PRADESH",23,10,2022
BAKSHA,Others,2022-10-23T18:33:37.483,Others,JAUNPUR,3120913,"श्रीमान जी अगर आप अपना पीएम किसान सम्मान निधि का स्टेटस चेक करना चाहते हैं तो आप अपना रजिस्ट्रेशन नंबर बताएं तो आपको जानकारी दे दी जाएगी |","Information about of pm kisan samman nidhi yojna ..?","Government Schemes",NA,AGRICULTURE,"UTTAR PRADESH",23,10,2022
SAURIKH,Others,2022-10-23T18:36:57.553,Others,KANNAUJ,3120852,"श्रीमान जी प्रधानमंत्री किसान सम्मान निधि योजना के बारे में अधिक जानकारी के लिए अपने नजदीकी ब्लॉक पर बीज गोदाम प्रभारी महोदय से जिले पर जिला कृषि उपनिदेशक कार्यालय पर अधिक जानकारी के लिए निशुल्क नंबर 1800 180 1488 पर संपर्क करें|","INFORMATION ABOUT OF PM KISHAN SAMMAN NIDHI STATUS ?","Government Schemes",NA,AGRICULTURE,"UTTAR PRADESH",23,10,2022
BHARTHANA,Oilseeds,2022-10-23T18:40:32.007,Mustard,ETAWAH,3120862,"श्रीमान जी सरसों की फसल में खरपतवार नियंत्रण के लिए - पैन्डीमेथलीन - 30 ई.सी. – 1. लीटर प्रति एकड़ की दर से 200 लीटर पानी में घोल बनाकर फसल बुवाई के 72 घंटे के अंदर स्प्रे करें  ","Provide information related to weed management in Mustard crop ?","Weed Management",NA,AGRICULTURE,"UTTAR PRADESH",23,10,2022
TAMKUHIRAJ,Others,2022-10-23T18:44:00.61,Others,"KUSHI NAGAR",3120836,"श्रीमान जी पीएम किसान सम्मान निधि की जानकारी तकनीकी समस्या के कारण देने में असमर्थ हैं अतः आप टोल फ्री नंबर 1800 180 1488 संपर्क करें अथवा राजकीय बीज भंडार या कृषि निदेशक कार्यालय पर करें","Information about PM Kisan Samman Nidhi..?","Government Schemes",NA,AGRICULTURE,"UTTAR PRADESH",23,10,2022
TODARPUR,Others,2022-10-23T18:46:28.827,Others,HARDOI,3120920,"श्रीमान जी अधिक जानकारी हेतु  पीएम किसान सम्मान निधि के टोल फ्री नंबर 1800 180 1488 पर संपर्क करें|

","Information about PM- Kisan Samman Nidhi Yojana (PM- KSNY) .....?","Government Schemes",NA,AGRICULTURE,"UTTAR PRADESH",23,10,2022
PATEHRA,Others,2022-10-23T18:48:55.81,Others,MIRZAPUR,3120846,"श्रीमान जी प्रधानमंत्री किसान सम्मान निधि के अंतर्गत आप विकासखंड पर बीज भंडार प्रभारी जी से अथवा जनपद पर उप कृषि निदेशक जी से संपर्क करें
प्रधानमंत्री किसान हेल्पलाइन नंबर 011 2430 0606 अथवा 155261 पर संपर्क करें
उत्तर प्रदेश विभाग द्वारा कृषि निदेशालय से संबंधित 12वीं किस्त प्रधानमंत्री किसान सम्मान निधि से संबंधित हेल्पलाइन नंबर  1800 180 1488 सुबह 10:00 बजे से लेकर शाम 5:00 बजे तक में संपर्क करें
श्रीमान जी कृषि निदेशालय से संबंधित प्रधानमंत्री किसान सम्मान निधि हेल्पलाइन नंबर 1800 180 5450  कॉल करें उस पर अपना आधार नंबर डालें आपको आप का रजिस्ट्रेशन नंबर प्राप्त हो जाएगा और बैलेंस की जानकारी प्राप्त हो जाएगी
","Information about of Pradhan Mantri Kisan Samman Nidhi scheme status
","Government Schemes",NA,AGRICULTURE,"UTTAR PRADESH",23,10,2022
RAMNAGAR,Animal,2022-10-23T18:50:22.25,"Bovine(Cow,Buffalo)",CHITRAKOOT,3118680,"--श्रीमान जी दिए गए नंबर  पर संपर्क करें-05812310058","???? ?? ????? ?? ??? ?? ???? ??? ?????? ?? ??? ???","Dairy Production",NA,"ANIMAL HUSBANDRY","UTTAR PRADESH",23,10,2022
PUREDALAI,Oilseeds,2022-10-23T18:53:55.173,Mustard,BARABANKI,3120858,"श्री मान जी ,सरसों की उन्नत प्रजातियां-आर.एच. 0749, टी 59 (वरुण), आर.एच. 0406 का प्रयोग करें|","Information about varieties of mustard...?",Varieties,NA,AGRICULTURE,"UTTAR PRADESH",23,10,2022
PRATAPPUR,Others,2022-10-23T19:03:44.493,Others,ALLAHABAD,3120928,"
श्रीमान जी प्रधानमंत्री किसान सम्मान निधि योजना से संबंधित अधिक जानकारी के लिए आप अपने यहां के राजकीय बीज गोदाम प्रभारी या
जिला कृषि उपनिदेशक कार्यालय पर संपर्क करें या विभाग के नंबर पर संपर्क - 011 – 23381092, 011-24300606 करके जानकारी प्राप्त
करें","--Tell me about the Pradhan Mantri Kisan Samman Nidhi Yojana ?","Government Schemes",NA,AGRICULTURE,"UTTAR PRADESH",23,10,2022
LALAURIKHERA,Others,2022-10-23T19:07:58.46,Others,PILIBHIT,3120924,"श्रीमान जी प्रधानमंत्री किसान सम्मान निधि योजना में अपने स्टेटस की जानकारी प्राप्त करने के लिए जो डाटा आपने उपलब्ध कराया है उससे  कोई भी पंजीकरण नहीं दिखा रहा है कृपया आप अधिक जानकारी के लिए  पीएम किसान के हेल्पलाइन नंबर -011-24300606 ,1800115526 पर आधार के माध्यम से जानकारी प्राप्त करें अथवा जिले पर उप कृषि निदेशक कार्यालय से संपर्क करें    ","Information regarding Installment status in P M Kisan Samman Nidhi Yojana….?   ","Government Schemes",NA,AGRICULTURE,"UTTAR PRADESH",23,10,2022
PATEHRA,Others,2022-10-23T19:09:55.833,Others,MIRZAPUR,3120848,"प्रधानमंत्री किसान सम्मान निधि योजना के तहत आप प्रधानमंत्री किसान सम्मान निधि हेल्पलाइन   18001801488  नंबर पर संपर्क करें","
Information about 12th installment under Pradhan Mantri kisan samman nidhi yojna?","Government Schemes",NA,AGRICULTURE,"UTTAR PRADESH",23,10,2022
BHAGYANAGAR,Others,2022-10-24T11:30:52.133,Others,AURAIYA,3128918,"महोदय, आपकी प्रधानमंत्री किसान सम्मान निधि योजना की 12 वीं क़िस्त भुगतान संसाधित है, अधिक जानकारी के लिए जिले के उप कृषि निदेशक कार्यालय में संपर्क करे |","Information about  PM Kisan Samman Nidhi Yojna Beneficiary status .?","Government Schemes",NA,AGRICULTURE,"UTTAR PRADESH",24,10,2022
HASAYAN,Vegetables,2022-10-24T11:31:04.223,Potato,HATHRAS,3128543,"श्रीमान आलू के बीज को उपचारित करने के लिए  कार्बेन्डाजिम 50% डब्ल्यू. पी, कि 2 से 2.5 ग्राम मात्रा प्रति लीटर पानी में घोलकर छिड़काव करें |","Provide information for seed treatment in potato crop ?","Seeds and Planting Material",NA,HORTICULTURE,"UTTAR PRADESH",24,10,2022
