BlockName,Category,CreatedOn,Crop,DistrictName,KCCCallID,KccAns,QueryText,QueryType,Season,Sector,StateName,day,month,year
MALASA,Others,2022-10-24T10:33:03.413,Others,"KANPUR DEHAT",3128349,"महोदय 24- 29 अक्टूबर तक मौसम साफ रहने की संभावना है आज का न्यूनतम तापमान 18 - 20 डिग्री सेल्सियस ,अधिकतम तापमान
 28 -30 डिग्री सेल्सियस तापमान हवा की गति 4 -7 किलोमीटर प्रति घंटा रहने की संभावना है मौसम के अनुसार ही कृषि कार्य करे
","Farmer asked query on Weather",Weather,NA,AGRICULTURE,"UTTAR PRADESH",24,10,2022
KURAOLI,Others,2022-10-24T10:34:10.103,Others,MAINPURI,3129196,"श्रीमान जी प्रधानमंत्री किसान सम्मान निधि में अपने बैंक खाता और आधार कार्ड को एनपीसीआई से लिंक करा लें इसके लिए अपने बैंक में संपर्क करें","information about pm kisan samman nidhi ","Government Schemes",NA,AGRICULTURE,"UTTAR PRADESH",24,10,2022
CHANDAULI,Others,2022-10-24T10:34:11.12,Others,CHANDAULI,3129364,"श्रीमान जी पीएम किसान सम्मान निधि योजना के अंतर्गत भूलेख का विवरण पीएम किसान पोर्टल पर दर्ज नहीं है कृपया अपने लेखपाल महोदय से संपर्क करके भूमि का विवरण पोर्टल पर दर्ज कराएं।","Please provide Know Beneficiary Status information under PM Kisan Samman Nidhi Yojana. ? 
","Government Schemes",NA,AGRICULTURE,"UTTAR PRADESH",24,10,2022
BALAHA,Others,2022-10-24T10:34:55.703,Others,BAHRAICH,3129257,"महोदय प्रधानमंत्री किसान सम्मान निधि की समस्या से संबंधित समाधान हेतु आप अपने ब्लॉक के राज्य कृषि बीज प्रभारी महोदय से संपर्क करें तथा कृषि भवन के उप कृषि महोदय से संपर्क करें अधिक जानकारी के लिए टोल फ्री नंबर 115526,01124300606 पर संपर्क करें
","Information about Prime Minister Kisan Samman Nidhi ?
","Government Schemes",NA,AGRICULTURE,"UTTAR PRADESH",24,10,2022
KHAJNI,Others,2022-10-24T10:35:27.573,Others,GORAKHPUR,3128962,"श्रीमान जी प्रधानमंत्री सम्मान निधि योजना में किस्तों से संबंधित शिकायत एवं सुझाव के लिए 18001801488 पर संपर्क करें .
","Information of Pradhan mantri kisan samman nidhi yojna Status...? 
","Government Schemes",NA,AGRICULTURE,"UTTAR PRADESH",24,10,2022
"QADAR CHOWK",Others,2022-10-24T10:36:15.48,Others,BADAUN,3128540,"महोदय, आप अपने बैंक खाते को एनपीसीआई एवं आधार से लिंक कराएं तथा उप कृषि निदेशक कार्यालय से संपर्क करें |

महोदय, प्रधानमंत्री किसान सम्मान निधि योजना में आप की जमीन का सत्यापन रुका हुआ है कृपया अपने लेखपाल से मिलकर अपनी जमीन का सत्यापन कराएं |
","Information about beneficiary status of PM kisan samman nidhi yojna ...?","Government Schemes",NA,AGRICULTURE,"UTTAR PRADESH",24,10,2022
"MUSAFIR KHANA","Fiber Crops",2022-10-24T10:37:12.733,"Cotton (Kapas)",SULTANPUR,3129679,"श्रीमान जी,कपास की बुवाई का उपयुक्त समय (आगरा और मथुरा जनपद को छोड़कर) देसी प्रजातियों के लिए अप्रैल महीने में एवं अमेरिकन प्रजातियों की बुवाई मध्य अप्रैल से मई के प्रथम सप्ताह तक की जाती है|","Information about sowing time of Cotton?","Cultural Practices",NA,AGRICULTURE,"UTTAR PRADESH",24,10,2022
PIHANI,Others,2022-10-24T10:42:36.887,Others,HARDOI,3129197,"श्रीमान जी प्रधानमंत्री किसान सम्मान निधि योजना से संबंधित अधिक जानकारी के लिए आप अपने जिले पर उप कृषि निदेशक या ब्लॉक पर बीज गोदाम प्रभारी जी से संपर्क करें

","Information about Pradhan Mantri Kisan Samman Nidhi Yojana?

","Government Schemes",NA,AGRICULTURE,"UTTAR PRADESH",24,10,2022
BIRDHA,Pulses,2022-10-24T10:47:21.367,"Bengal Gram (Gram/Chick Pea/Kabuli/Chana)",LALITPUR,3125584,"श्रीमान जी 24 अक्टूबर - 29 अक्टूबर तक मौसम साफ रहेगा बारिश होने की कोई संभावना नहीं है आंशिक रूप से हल्के बादल छाए रहेंगे न्यूनतम तापमान 20 °Cअधिकतम तापमान 27°C हवा की गति 4- 11 किलोमीटर प्रति घंटे की रफ्तार चलने की संभावना है मौसम के अनुसार कृषि कार्य करें","Farmer asked query on Weather",Weather,NA,AGRICULTURE,"UTTAR PRADESH",24,10,2022
MALASA,Cereals,2022-10-24T10:48:44.063,"Paddy (Dhan)","KANPUR DEHAT",3128348,"श्रीमान जी आपके क्षेत्र में 24 अक्टूबर से 29 अक्टूबर तक पूरे सप्ताह बारिश या बूंदाबांदी की कोई संभावना नहीं है ,आंशिक रूप से बादल छाए रहेंगे ,आज का अधिकतम तापमान 31°C ,न्यूनतम तापमान 26°C, हवाएं आपके क्षेत्र में  07 से 11 किलोमीटर प्रति घंटे की रफ्तार से चलने की संभावना है मौसम के अनुसार कृषि कार्य करें |
","Farmer asked query on Weather",Weather,NA,AGRICULTURE,"UTTAR PRADESH",24,10,2022
MAT,Others,2022-10-24T10:57:37.177,Others,MATHURA,3128384,"श्रीमान जी प्रधानमंत्री किसान सम्मान निधि हेतु टोल फ्री नंबर  PM-Kisan Helpline No. 155261 / 011-24300606
 011-23381092 पर संपर्क करें
प्रधानमंत्री किसान सम्मान निधि योजना (पी० ऍम० किसान) कंट्रोल रूम फ़ोन न०       -0522-2204450,0522-2204460,0522-2204480,0522-2204490
","Information about Pradhan Mantri Kisan Samman Nidhi scheme...?
","Government Schemes",NA,AGRICULTURE,"UTTAR PRADESH",24,10,2022
AZMATGARH,Others,2022-10-24T10:58:58.453,Others,AZAMGARH,3129170,"श्रीमान जी किसान सम्मान निधि योजना के अंतर्गत की स्थिति जानने के लिए पीएम किसान की ऑफिशियल वेबसाइट www.pmkisan.gov.in पीएम  के माध्यम से पंजीकृत मोबाइल नंबर या पंजीकरण संख्या दर्ज करके स्थिति की जानकारी प्राप्त करें या पीएम किसान हेल्पलाइन नंबर 155261/ 011-24300606 पर कॉल करके पंजीकृत मोबाइल नंबर या पंजीकृत आधार नंबर दर्ज करके स्थिति जान सकते हैं।","Please provide Know Beneficiary Status information under PM Kisan Samman Nidhi Yojana. ? 
","Government Schemes",NA,AGRICULTURE,"UTTAR PRADESH",24,10,2022
HANDIA,Others,2022-10-24T11:01:27.79,Others,ALLAHABAD,3128815,"श्रीमान जी आपके यहां 24 अक्टूबर से 29 अक्टूबर के बीच में आंशिक रूप से बादल छाए रहेंगे,लेकिन बारिश होने की संभावना नहीं है, लगभग मौसम साफ रहने की संभावना है,आज का न्यूनतम तापमान 23 °C और अधिकतम तापमान 31 °C एवं हवा की गति 7 से 11 किलोमीटर प्रति घंटा रहने की संभावना है,मौसम के अनुसार कृषि कार्य को करें |","Farmer asked query on Weather",Weather,NA,AGRICULTURE,"UTTAR PRADESH",24,10,2022
CHAUMUHA,Oilseeds,2022-10-24T11:03:42.76,Mustard,MATHURA,3124356,"श्रीमान जी, सरसों में  कार्बेन्डाजिम 12%+ मैंकोजेब  63%  400 ग्राम  / एकर  180 लीटर  पानी  में  घोल  कर  स्प्रे  करे |
","Provide about information in Fungal disease of Mustard crop..?
","	Plant Protection	",NA,AGRICULTURE,"UTTAR PRADESH",24,10,2022
NAKUR,Others,2022-10-24T11:09:06.197,Others,SAHARANPUR,3129387," महोदय, आपकी प्रधानमंत्री किसान सम्मान निधि योजना की 12 वीं क़िस्त भुगतान संसाधित है, अधिक जानकारी के लिए जिले के उप कृषि निदेशक कार्यालय में संपर्क करे |","Information of PM Kisan Samman Nidhi know beneficiary status ...?","Government Schemes",NA,AGRICULTURE,"UTTAR PRADESH",24,10,2022
BAMAUR,Others,2022-10-24T11:20:25.78,Others,JHANSI,3128637,"महोदय, आपके क्षेत्र में 24-29 अक्टूबर के बीच बारिश होने की संभावना नहीं है, मौसम साफ रहेगा, आज का न्यूनतम तापमान 22°C और अधिकतम तापमान 29°C एवं हवा की गति 2 किलोमीटर प्रति घंटा रहने की संभावना है। मौसम के अनुसार कृषि कार्य को करे |","Farmer asked query on Weather",Weather,NA,AGRICULTURE,"UTTAR PRADESH",24,10,2022
USAWAN,Oilseeds,2022-10-24T11:22:20.97,Mustard,BADAUN,3129733,"महोदय, सरसों की बुवाई का समय असिंचित क्षेत्र में 15 सितम्बर से 15 अक्टूबर है तथा सिंचित क्षेत्र में 10 अक्टूबर से 30 अक्टूबर के मध्य में करे
","Information of sowing time of Mustard crops ...?
","Sowing Time and Weather",NA,AGRICULTURE,"UTTAR PRADESH",24,10,2022
KYARA,Others,2022-10-24T11:22:33.06,Others,BAREILLY,3129391,"श्रीमान जी ड्रैगन फ्रूट बीज के लिए उद्यान विभाग पर संपर्क करें","provide about information of Dragon fruit crop ?","	Plant Protection	",NA,AGRICULTURE,"UTTAR PRADESH",24,10,2022
