BlockName,Category,CreatedOn,Crop,DistrictName,KCCCallID,KccAns,QueryText,QueryType,Season,Sector,StateName,day,month,year
GOHAND,Vegetables,2022-10-24T11:31:44.05,Brinjal,HAMIRPUR,3128629,"श्रीमान जी बैगन की फसल में तना बेधक एवं फल बेधक कीट के नियंत्रण के लिए थियाक्लोप्रिड 400 मिलीलीटर प्रति एकड़ 200 लीटर पानी में घोलकर छिड़काव करें","Information about pest management of shoot and fruit borer in brinjal crop ?
","	Plant Protection	",NA,HORTICULTURE,"UTTAR PRADESH",24,10,2022
CHHIBRAMAU,Vegetables,2022-10-24T11:35:12.247,Potato,KANNAUJ,3129394,"श्रीमान जी आप आलू के बीज को शोधित करने के लिए Pencycuron 22.9% SC की 1ml को प्रति लीटर पानी के घोल में आलू के बीज को 10 से 15 मिनट  डूबाने के बाद बुवाई करें","information about seed treatment of potato","Cultural Practices",NA,HORTICULTURE,"UTTAR PRADESH",24,10,2022
HOLAGARH,Others,2022-10-24T11:44:20.837,Others,ALLAHABAD,3129179,"महोदय, प्रधानमंत्री किसान सम्मान निधि योजना में अपना रजिस्ट्रेशन नंबर जानने के लिए आप अपने नजदीकी जन सेवा केंद्र पर संपर्क करें, या फिर अपने ब्लॉक पर राजकीय कृषि बीज भंडार पर जाकर सूची में देखें अथवा प्रधानमंत्री किसान सम्मान निधि योजना के टोल फ्री नंबर 01123381092, 155261, 1800115526, 011 24300606 पर संपर्क करें |","Information about beneficiary status of PM kisan samman nidhi yojna ...?","Government Schemes",NA,AGRICULTURE,"UTTAR PRADESH",24,10,2022
"BADLA PUR",Others,2022-10-24T11:52:45.87,Others,JAUNPUR,3129406,"P.M Kisan servers are down for maintenance
","ASKING ABOUT PM KISAN","Government Schemes",NA,AGRICULTURE,"UTTAR PRADESH",24,10,2022
THAKURDWARA,Others,2022-10-24T11:53:18.49,Others,MORADABAD,3129412,"श्रीमान जी पीएम किसान सम्मान निधि योजना के अंतर्गत भूलेख का विवरण पीएम किसान पोर्टल पर दर्ज नहीं है कृपया अपने लेखपाल महोदय से संपर्क करके भूमि का विवरण पोर्टल पर दर्ज कराएं।
","Please provide Know Beneficiary Status information under PM Kisan Samman Nidhi Yojana. ? 
","Government Schemes",NA,AGRICULTURE,"UTTAR PRADESH",24,10,2022
JAITPUR,Cereals,2022-10-24T12:02:30.777,"Barley (Jau)",MAHOBA,3129051,"जौ की यह नई प्रजाति प्रति हेक्टेयर 50-60 कुंतल उपज देती है. बुआई के बाद 30-35 दिन पहली सिंचाई तथा फूल आने पर दूसरी सिंचाई करनी पड़ती है. यह लगभग 120 दिन में तैयार हो जाती है. साथ ही इसमें अधिक प्रोटीन तथा पीली गेरुई, धब्बा रोग के प्रति अधिक प्रतिरोधक गुण हैं.","Information about details of HUB-113 Barley variety",Varieties,NA,AGRICULTURE,"UTTAR PRADESH",24,10,2022
BANGRA,Vegetables,2022-10-24T12:03:23.21,"Peas (field peas/ garden peas/matar)",JHANSI,3129417,"----मटर की प्रजाति -रचना,मालवीय मटर 2,15,पन्त मटर 5,शिखा(के.एफ.पी.डी.-103),विकास (आईपीएफडी 99-13),प्रकाश,जे.पी.-885","Varieties of Pea ?","Seeds and Planting Material",NA,HORTICULTURE,"UTTAR PRADESH",24,10,2022
SADABAD,Vegetables,2022-10-24T12:04:26.98,Potato,HATHRAS,3129033,"श्रीमान आलू की फसल में उर्वरक की मात्रा - यूरिया 107 किलोग्राम डीएपी 65 किलोग्राम तथा पोटाश 68 किलोग्राम प्रति एकड़","provide about information of fertilizer in potato crop ?","	Plant Protection	",NA,HORTICULTURE,"UTTAR PRADESH",24,10,2022
MANIHARI,Oilseeds,2022-10-24T12:08:06.847,Mustard,GHAZIPUR,3128789,"श्रीमान जी सरसों की फसल में खरपतवार नियंत्रण के लिए पेन्डीमेथलीन 30 % ई.सी @ 1200 ml प्रति एकड़ की दर से 200 लीटर पानी में घोल बनाकर बुवाई के बाद अंकुरण के पहले 48 से 72 घंटे के अंदर छिड़काव करें |
","Information about weed management in mustard crop ?","Weed Management",NA,AGRICULTURE,"UTTAR PRADESH",24,10,2022
MOHAMMADPUR,Others,2022-10-24T12:09:11.837,Others,AZAMGARH,3129435,"श्रीमान जी प्रधानमंत्री सम्मान निधि योजना में किस्तों से संबंधित शिकायत एवं सुझाव के लिए 18001801488 पर संपर्क करें .","Information of Pradhan mantri kisan samman nidhi yojna Status...?","Government Schemes",NA,AGRICULTURE,"UTTAR PRADESH",24,10,2022
BHADPURA,Oilseeds,2022-10-24T12:10:35.14,Mustard,BAREILLY,3128475,"श्रीमान जी सरसो या राई की प्रजातिया है वरुणा(टाइप-59 ), प्रकाश, वरदान, शेखर,  पूसा बोल्ड, क्रांति(P.R..-5), आशीर्वाद, नरेंद्र राई-8501, बसंती माया, पीताम्बरी I

 सरसों की विलम से की जाने वाली वैरायटी आशीर्वाद और वरदान है
","Asking about  MUSTARD AND RAI VARIETY ?.
",Varieties,NA,AGRICULTURE,"UTTAR PRADESH",24,10,2022
SANDALPUR,Others,2022-10-24T12:12:42.64,Others,"KANPUR DEHAT",3128727,"श्रीमान जी प्रधानमंत्री किसान सम्मान निधि योजना के अंतर्गत आपके भारतीय स्टेट बैंक के खाते में 10 किस्तों का भुगतान किया जा चुका है और आपकी पंजीकरण संख्या UP259672566 है","Provide information related to Pradhan Mantri Kisan Samman Nidhi Yojana
","Government Schemes",NA,AGRICULTURE,"UTTAR PRADESH",24,10,2022
"HAINSAR BAZAR",Others,2022-10-24T12:13:10.75,Others,"SANT KABIR NAGAR",3129422,"श्रीमान जी प्रधानमंत्री कुसुम योजना के तहत सोलर पंप पर 60% अनुदान दिया जा रहा है सोलर पंप पर बुकिंग 20 अक्टूबर 20/10/2022 से प्रातः 11:00 बजे से बुकिंग शुरू हो गई है जो कि लक्ष्य पूर्ण होने तक चलेगी |आप विभागीय वेबसाइट www.upagriculture.com 
 से सोलर पंप हेतु बुकिंग कर सकते हैं |","Information about beneficiary status of Pm Kisan Samman Nidhi Yojana..? 
","Government Schemes",NA,AGRICULTURE,"UTTAR PRADESH",24,10,2022
"NEBUA NAURANGIA",Others,2022-10-24T12:17:57.65,Others,"KUSHI NAGAR",3129004,"श्रीमान जी प्रधानमंत्री किसान सम्मान निधि योजना के के अंतर्गत आप का रिकॉर्ड पीएफएमएस / बैंक द्वारा किसान रिकॉर्ड को खारिज कर दिया गया है, अधिक जानकारी के लिए आप अपने विकासखंड पर बीज गोदाम प्रभारी कार्यालय या जिले पर जिला कृषि उपनिदेशक कार्यालय से जानकारी प्राप्त करें |
","Provide information about Pradhanmantri Kisan Samman Nidhi Yojana….?
","Government Schemes",NA,AGRICULTURE,"UTTAR PRADESH",24,10,2022
"KAURI RAM",Others,2022-10-24T12:20:07.223,Others,GORAKHPUR,3128601,"महोदय दलहनी फसलों में एसएसपी का प्रयोग DAP या NPK 12:32:16 से बेहतर होता है |","Information about fertilizer use in pules crop ?","Fertilizer Use and Availability",NA,AGRICULTURE,"UTTAR PRADESH",24,10,2022
BAHERI,Others,2022-10-24T12:20:15.927,Others,BAREILLY,3128797,"महोदय, प्रधानमंत्री किसान सम्मान निधि योजना में अपना रजिस्ट्रेशन नंबर जानने के लिए आप अपने नजदीकी जन सेवा केंद्र पर संपर्क करें, या फिर अपने ब्लॉक पर राजकीय कृषि बीज भंडार पर जाकर सूची में देखें अथवा प्रधानमंत्री किसान सम्मान निधि योजना के टोल फ्री नंबर 01123381092, 155261, 1800115526, 011 24300606 पर संपर्क करें |","Information about beneficiary status of PM kisan samman nidhi yojna ...?","Government Schemes",NA,AGRICULTURE,"UTTAR PRADESH",24,10,2022
CHOPAN,Others,2022-10-24T12:25:49.503,Others,SONBHADRA,3128734,"श्रीमान जी पीएम किसान सम्मान निधि योजना में खाता नंबर एवं आधार नंबर सुधार के लिए अपने ब्लॉक पर या अपने जिले के कृषि उपनिदेशक कार्यालय में संपर्क करें तथा स्थिति जानने के लिए टोल फ्री नंबर 18001801488 पर कॉल करें या ऑनलाइन www.pmkisan.gov.in पर सुधार कर सकते है।","Information related to PM Kisan Samman Nidhi ?

","Government Schemes",NA,AGRICULTURE,"UTTAR PRADESH",24,10,2022
AMAULI,Cereals,2022-10-24T12:33:37.347,Wheat,FATEHPUR,3128720,"श्रीमान जी, गेहूं की छोटे आकार की किस्मों के लिए 40 किलो बीज प्रति एकड़ में प्रयोग करें और मोटे किस्म के बीजों के लिए 50 किलो बीज प्रति एकड़ में प्रयोग करें। यदि पिछेती बिजाई करनी हो तो 60 किलो बीज प्रति एकड़ में प्रयोग करें।","Provide information related to suitable seed rate for sowing wheat crop
",Seeds,NA,AGRICULTURE,"UTTAR PRADESH",24,10,2022
KURARA,Cereals,2022-10-24T12:34:55.487,Wheat,HAMIRPUR,3129718,"श्रीमान जी सिंचित दशाओं में गेहूं बुआई का समय नवम्बर के प्रथम सप्ताह से 25 नवंबर तक है |","Information about sowing time of wheat in irrigated conditions?","Sowing Time and Weather",NA,AGRICULTURE,"UTTAR PRADESH",24,10,2022
"JAWAN SIKANDERPUR",Others,2022-10-24T12:36:07.26,Others,ALIGARH,3129447,"श्रीमानजी  किसान सम्मान निधि के संशोधन के लिए जिला उप कृषि निदेशक से संपर्क करे , हेल्पलाइन नंबर 155261 टोल फ्री नंबर 1800 -11- 5526 पर संपर्क करें","provide about information of bank account correction in Kisan Samman Nidhi ?","Government Schemes",NA,AGRICULTURE,"UTTAR PRADESH",24,10,2022
MEJA,Cereals,2022-10-24T12:43:46.43,"Paddy (Dhan)",ALLAHABAD,3128608,"महोदय आपके क्षेत्र में आज दिनांक 24 अक्टूबर से 29 अक्टूबर तक आंशिक रूप से बादल छाए रह सकते है तथा इस बीच बारिस की कोई भी संभावना नहीं है दिन का अधिकतम तापमान 33 डिग्री सेल्सियस न्यूनतम तापमान 21 डिग्री सेल्सियस रह सकता है , हवा की गति 4 - 7  किलोमीटर प्रति घंटे की रफ़्तार से चल सकती है अतः मौसम को ध्यान में रखकर अपना कृषि कार्य कीजिये।   ","Farmer asked query on Weather",Weather,NA,AGRICULTURE,"UTTAR PRADESH",24,10,2022
NARAINI,Cereals,2022-10-24T12:44:10.813,"Paddy (Dhan)",BANDA,3128723,"धान की कटाई के 5 दिन पूर्व कोई भी कवकनाशी का प्रयोग नहीं किया जा सकता है","Any fungicide can be used 5 days before harvesting paddy?","	Plant Protection	",NA,AGRICULTURE,"UTTAR PRADESH",24,10,2022
AMARIYA,Others,2022-10-24T12:45:17.38,Others,PILIBHIT,3128532," श्रीमान जी प्रधानमंत्री किसान सम्मान निधि योजना से संबंधित अधिक जानकारी के लिए आप अपने यहां के राजकीय बीज गोदाम प्रभारी या जिला कृषि उपनिदेशक कार्यालय पर संपर्क करें या विभाग के नंबर पर संपर्क - 011 - 23381092 करके जानकारी प्राप्त करें ","Provide information related to Pradhan Mantri Kisan Samman Nidhi Yojana..?","Government Schemes",NA,AGRICULTURE,"UTTAR PRADESH",24,10,2022
NOHJHIL,Cereals,2022-10-24T12:46:01.42,"Barley (Jau)",MATHURA,3129046,"सिंचित दशाओं में जौ की बुवाई का समय 1 नवंबर से 25 नवंबर है|","information about the sowing time of Barley in irrigated condition","Sowing Time and Weather",NA,AGRICULTURE,"UTTAR PRADESH",24,10,2022
KORAON,Others,2022-10-24T12:47:52.63,Others,ALLAHABAD,3129068,"श्रीमान जी प्रधानमंत्री किसान सम्मान निधि योजना में किस्तों की अधिक जानकारी के लिए टोल फ्री नंबर 18001801488 पर संपर्क करें.	","Information about pm Kisan Samman Nidhi status check …?	","Government Schemes",NA,AGRICULTURE,"UTTAR PRADESH",24,10,2022
PALIA,Others,2022-10-24T12:48:47.7,Others,KHERI,3125565,"श्रीमन जी भूमि शोधन हेतु 2.5 किग्रा प्रति हेक्टेयर ट्राइकोडरमा को लगभग 75 किग्रा गोबर की खाद में मिलाकर हल्के पानी का छीटा देकर 8-10 दिन तक छाया में रखने के उपरान्त बुवाई से पूर्व भूमि में मिला देना चाहिए।
बीज उपचार- थीरम 2gm प्रति KG बीज की दर से या ट्राइकोडरमा विराइड 2gm प्रति किलो बीज की दर से उपचारित करके बुवाई करें | 
","Provide information how to use trichoderma","Cultural Practices",NA,AGRICULTURE,"UTTAR PRADESH",24,10,2022
CHHAPRAULI,Fruits,2022-10-24T12:49:15.64,Citrus,BAGHPAT,3129699,"श्री मान जी Copper oxychloride 50% WP @ 500 ग्राम प्रति एकड़ 200 लीटर पानी के साथ घोल बनाकर छिड़काव करें","Information about the control of Blight in crop","Bio-Pesticides and Bio-Fertilizers",NA,HORTICULTURE,"UTTAR PRADESH",24,10,2022
"MAHARAJ GANJ",Others,2022-10-24T12:50:27.54,Others,JAUNPUR,3128634,"श्रीमान जी पीएम किसान सम्मान निधि योजना के अंतर्गत भूलेख का विवरण पीएम किसान पोर्टल पर दर्ज नहीं है कृपया अपने लेखपाल महोदय से संपर्क करके भूमि का विवरण पोर्टल पर दर्ज कराएं।
","Please provide Know Beneficiary Status information under PM Kisan Samman Nidhi Yojana. ? 
","Government Schemes",NA,AGRICULTURE,"UTTAR PRADESH",24,10,2022
MATHURA,Cereals,2022-10-24T12:53:01.917,Wheat,MATHURA,3128483,"श्री मान जी गेहू  बुवाई के लिए  प्रजातिया है- यू०पी०-2382 ,डीबीडब्लू-17 ,पी०बी०डब्लू०-343 ,डीबीडब्लू-187 ,HD-2967 ,DBW-222. 
","Information about wheat crop variety..? 
",Varieties,NA,AGRICULTURE,"UTTAR PRADESH",24,10,2022
BILSANDA,Oilseeds,2022-10-24T10:12:28.893,Mustard,PILIBHIT,3129330,"--पिछेती बिजाई के लिए
 
Aashirwad: यह पिछेती बिजाई के लिए उपयुक्त किस्म है। इसके पौधे की ऊंचाई 130-140 सैं.मी. होती है। इसमें तेल की मात्रा 39-42 प्रतिशत होती है। यह किस्म 120-130 दिनों में कटाई के लिए तैयार हो जाती है। इसकी औसतन पैदावार 5-6 क्विंटल प्रति एकड़ होती है।
 
Varadan: यह यू पी के सभी क्षेत्रों में खेती करने के लिए उपयुक्त है। यह किस्म 120-125 दिनों में कटाई के लिए तैयार हो जाती है। इसकी औसतन पैदावार 6-8 क्विंटल प्रति एकड़ होती है।","Information about Verities in mustard crop....?",Varieties,NA,AGRICULTURE,"UTTAR PRADESH",24,10,2022
GONDLAMAU,Oilseeds,2022-10-24T10:15:21.447,Mustard,SITAPUR,3128374,"श्रीमान जी, यूरिया 105 kg (दो भागों में बांटकर), सिंगल सुपर फास्फेट 150 kg, म्यूरेट ऑफ पोटाश 40 kg प्रति एकड़ प्रयोग करे |","Information about fertilizer management in Mustard..?","Fertilizer Use and Availability",NA,AGRICULTURE,"UTTAR PRADESH",24,10,2022
EKA,Others,2022-10-24T10:23:16.683,Others,FIROZABAD,3128653,"
श्रीमान जी प्रधानमंत्री किसान सम्मान निधि कि 12 किस्त का भुगतान सफलतापूर्वक आप के खातों में किया जा चुका है ","Information about Pradhan Mantri Kisan Samman Nidhi scheme...?
","Government Schemes",NA,AGRICULTURE,"UTTAR PRADESH",24,10,2022
BIKAPUR,Oilseeds,2022-10-24T10:24:11.313,Mustard,FAIZABAD,3128700,"श्रीमान जी सरसों की फसल में सिंचित एवं असिंचित क्षेत्रों में 5-6 किग्रा०0/हे0की दर से प्रयोग करना चाहिए।","Give information about seed rate for mustard crop","	Field Preparation	",NA,AGRICULTURE,"UTTAR PRADESH",24,10,2022
JAITHARA,Vegetables,2022-10-24T10:25:24.667,Potato,ETAH,3128454,"महोदय 24 अक्टूबर  से 29 अक्टूबर तक बारिश की कोई संभावना नहीं है मौसम साफ रहेगा आज का न्यूनतम तापमान 25 डिग्री सेल्सियस और अधिकतम तापमान 34 डिग्री सेल्सियस एवं हवा की गति 7 से 11 किलोमीटर प्रति घंटा रहने की संभावना है मौसम के अनुसार कृषि कार्य को करें","Farmer asked query on Weather",Weather,NA,AGRICULTURE,"UTTAR PRADESH",24,10,2022
RAJAPUR,Others,2022-10-24T10:26:06.63,Others,GHAZIABAD,3128787,"आपके नजदीकी कृषि विभाग में कृषि अधिकारी से संपर्क करें
","FARMER ASKED FERTILIZER COMPLAINT ?","Government Schemes",NA,AGRICULTURE,"UTTAR PRADESH",24,10,2022
KISHNI,Cereals,2022-10-24T10:26:34.897,"Paddy (Dhan)",MAINPURI,3128235,"श्रीमान जी, 24 अक्टूबर से 29 अक्टूबर के बीच आपके क्षेत्र में मौसम साफ रहेगा । आज का न्यूनतम तापमान 21°C और अधिकतम तापमान 34°C एवं हवा की गति 2-3 किलोमीटर प्रति घंटा रहने की संभावना है। अतः मौसम के अनुसार कृषि कार्य को करे | ","Farmer asked query on Weather",Weather,NA,AGRICULTURE,"UTTAR PRADESH",24,10,2022
DADRI,Cereals,2022-10-24T10:26:46.27,"Paddy (Dhan)","GAUTAM BUDDHA NAGAR",3122949,"  श्रीमान जी, 24 अक्टूबर से 29 अक्टूबर के बीच वर्षा होने की कोई संभावना नहीं है मौसम बिल्कुल साफ रहेगा.आज का न्यूनतम तापमान 19 °C और अधिकतम तापमान 32 °C एवं हवा की गति 4 से  11 किलोमीटर/ घंटा रहने की संभावना है| मौसम के अनुसार कृषि कार्य को करें| 
","Farmer asked query on Weather",Weather,NA,AGRICULTURE,"UTTAR PRADESH",24,10,2022
KISHNI,Oilseeds,2022-10-24T10:27:40.73,Mustard,MAINPURI,3128236,"सरसों की देर से बोई जाने वाली प्रजांतियाँ-आशीर्वाद,वरदान|","Information about late sowing variety of Mustard?",Varieties,NA,AGRICULTURE,"UTTAR PRADESH",24,10,2022
JAMALPUR,Others,2022-10-24T10:27:42.337,Others,MIRZAPUR,3129354,"श्रीमान जी किसान सम्मान निधि योजना के स्टेटस की जानकारी के लिए हेल्पलाइन नंबर 155261, 18001801488 011 24300606 है","Information about beneficiary status of PM Kisan samman nidhi scheme","Government Schemes",NA,AGRICULTURE,"UTTAR PRADESH",24,10,2022
NIGHASAN,Others,2022-10-24T10:29:00.727,Others,KHERI,3129062,"श्रीमान जी प्रधानमंत्री किसान सम्मान निधि योजना में आपके खाते में आठ किस्त राज्य सरकार द्वारा भेजी जा चुकी है अगली किस्त फार्म रिजेक्ट हो जाने के कारण रोक दी गई है अधिक जानकारी के लिए आप अपने ब्लॉक तथा जिले में कृषि उपनिदेशक कार्यालय से संपर्क करें |","Information about Prime Minister Kisan Samman Nidhi Yojana Status..? ","Government Schemes",NA,AGRICULTURE,"UTTAR PRADESH",24,10,2022
NAGWA,Vegetables,2022-10-24T10:30:04.89,Tomato,SONBHADRA,3129323,"श्रीमान जी टमाटर की फसल में प्लानोफिक्स 1ml / 4 लीटर पानी में घोलकर स्प्रे करें","About Information of flower control in tomato crop ?","	Plant Protection	",NA,HORTICULTURE,"UTTAR PRADESH",24,10,2022
